Topics,Helpers,Mentor,Question,text
,,dan-burns,How do you handle fatigue at work?,and it does happen yeah it's this is the navy runs on coffee yes all lost more of that war two so ladies and personally I was always a great job you bad coffee because we didn't have a Starbucks why should I so much is renowned Starbucks you can maybe global stock log but we knew that Starbucks or stuff and fats electrolytes and all that good stuff we have so if it's the is that the old for is or are you and ships you have to be in shape after all three of you have to put yourself whatever it's a month advising beat the crap out of themselves and for so sloppy for yeah and Dr state all the way especially if you're on the bridge and you've got a watch federal law yeah is there a way to get off to get the next watch we did it because you have reordered souls depending upon you and your job right and if you were on the ship grow one from ship because you're tired I will choose what's this all so drop in demand twenty and is there a way to question yeah you know your body past you know what you 
,,dan-burns,How do you ensure that boring work gets done well?,sure the boring work gets done okay one is back to the old phrase or expect what you inspect so if work gets done sure shop who is signing off on the there's a famous story about my several Campbell court I sell more records an abortion that city engineers how to repair your asus and it's only San Antonio was it is analysts the FAB ship and we're starting to get that stuff well the main mission the ship is what well off but you have to have a working Stargate everyone was very out of a local and that C. S. C. engineers got a plan that fits that yeah of the sort question for at signed off on that ship who said that that should do it yeah in that city encores and here's some thinking you can send the same engine out to fix it sign off so the what the people the technician yeah for stuff 
,,dan-burns,How do you deal with an increase in tempo?,they also increases first and foremost get the word out so the two the two divisions are should stop or whatever you want you can get the word out because no one one you need to prepare people so they should be ready to ramp up to it and there are going to be toxic okay we're going to be doing tomorrow morning followed by revealing okay all right the point our house well okay that's fine I'll step over that day that you're open to Saturday's or get back off on somebody or whatever one by details on the you can't tell if somebody's at sea being a day off hopefully there are some plausible they're always on that new book out well then you could wind up spending so they have known the very city and there's no way is home for the bridge which days not taken off on Sunday we try to make sure that the ship is right and also but doesn't change the ship the machine or the machine room wall that is possible I also but what's the fact all you as the the vision all Sir you have to make sure that that machine does that it wouldn't come off line you do quick lane that's a great back up on Hey this is wrong also called the FedEx office personnel then you're gonna go through periods of it well first of all the way to be ready for use to communicate them and the S. with a smile no one wants to go for that is that you do the mission 
,,dan-burns,What are common crimes people in your field commit that need to be watched for?,so so that you need to be aware of the situation also so if you're on mix cruise ship you've got to watch out for the social aspect and just given the training lack of them off you can be the water that that make sure or listen to she probably also or or eating at all Sir weeding suits you better sure all those of you know is there a problem that all the emails well all over the world only to you and tell all I was attacked in the larger now SO all mobile one is all the for calling off and all the water is a repeal well there's a lot to do so for us and so right that it also one or you know there will or will not yeah Wall lots of off so yeah well then you also need to watch out when you come back from the poor the the ship the crew in four ways yeah it's it's for you know six eight also and I thought you know okay and then the three of us the new members of the opposite sex that that goes into play a new battle itself Ultron for you have resources available to coming back with a lot of is the troopers will be flown out to the barber and if we're used to all the shows yeah and remind people about driving a and several rows of during that just needs to be reinforced people and the staff I don't have any faith for you sure because there was sort of the same J. and some of the hot I I do know that one of the tricks of the trade was on you know all of your bills one zero members on your bills in your own position of authority yeah see those those missing all of the city and all of the call our so you can walk a little that's pretty much it I would say the only there's you need to watch out for these days is waterfalls and log log password is do any of the confidential our system will power yeah I just it is one of the following is an all yeah well I live on that you're not using any power they get it out of the state law if we get our there is he not only in the same hour to be sure 
,,dan-burns,What worries do you have about your professional future?,worries as a junior also more fresh for use as a junior also yeah why do you know the first day of going through the ship you're gonna you're gonna select the ship to go to new duty station and is the first day yeah well so far and one of them like deal here why was I the guy to go they also built or if there's a social policy yeah well no one maybe if you but as a bid for the two of them maybe decided you are the right person to build in that job so we say you got the whole school for all I want both of you so that will do the job and and one brother well step but it's all slowly is that far your farm as for the generals general heighten struck out if you want to be far more souls of fire but okay well it's kind of hard to be a far more full the farmer happens it happens yeah you want will go on trial and that is what she said but on the first day of new command but it is in the profit the thought and that's what they'll be over before you know it then we have the seven day the seven day a week 
,,dan-burns,"If you could change one thing about your job, what would it be?",change one thing about job the we weren't able to communicate as well the family that you could do that where you have to write letters yeah actually the waters to our spouses shows that for both it's all my fault good good so the change now that you have faced they didn't call to your spouse that from the little that says it keeping your yeah you know you're fighting for flagging phone tree and whole it would be zero all your money also fighting for there's a little 
,,dan-burns,What used to be your biggest weaknesses?,the five day this course as those service for for also no way this is why this wall and therefore Viking swirls several we which in itself would imply for the heck of an eagle and a lot and they were so so you can never be too over coffee you can never be too under to be off at the beach so not having the confidence losing if possible at always your call maybe trust you family trust you needs trust your all yeah good for you all this 
,,dan-burns,Describe a time that you were put into an untenable ethical situation?,sounded good on some level of the goals situation I had to deal with my first six command I had to bring some mass a five as sexually harassed for in the upcoming on a brand new to this the best this is also the first day of March and then made aware of this as they I have the exact item also for all of that so why for the men last and recommended he be drawn and twenty two and a half months later twenty two out of my twenty four months command twenty two and a half months later the man was drawn that so I was a highly on some level of school situation that that member placed me does anyone to talk to you can't talk to me at the start of what you want to talk about an your now imagine officer yeah you can lock people I you can love what this whole situation Richard point where you are going to be fun and so I was not going to a lot of five Dr and as a result I was clear to other clear from one field on Tuesday to 
,,dan-burns,How do I deal with an assignment that I don't like or that isn't a good fit?,sorry I was not a good fit so you know we've got each command is roughly two years we've got and to your commands if you don't deal with any twenty years that's on you know you're gonna have commands a you're gonna live and I was shocked or I myself for the thirty year career fallout one guide fifteen commands so roughly at seventeen that stole from the beginning and of the seventeen there's only three of the seventeen that I would say I would not go back to it would not go back to work I did not like I hope you have to do what we like but when you're in during those three of seven three lots of not for if you will because you joined the navy to see the world and have a great for also follow along the way or or you don't you know frankly what are you one thing is if it's a personal offer you for the other person is going to the two years satellite channels that along with them and frankly if they're out of cycle we just the year before that person or persons changed out so first thing is to do that point is bringing their the outlook for because you don't want to be labeled as the problem child could get it done yeah so you for serve the nation remember that well this is Walmart Ford seven days well okay that's okay you can do that because the other four okay going to be fantastic that's a pretty good bad language 
,,dan-burns,What things are there for me to do on a ship?,are there for you to do all shows yeah well over over ships are called worships for a reason your ad will be sure about culture so one of the things is not there yeah sure of the ship as for the confirmation more you will also use the what we should have some type of yeah or some type of recreational activities and it is it is a smaller falls off on at were you know you don't have that much time off between washes you just watch the writer the division order the part save us if anyone deserves a little free washer under water in for the save anyone and inform you go all be it through a family war from apartment or whatever if your home and your cost is that from 
,,dan-burns,Do you have any kids?,right my eldest is is 
,,dan-burns,Do you have siblings?,brothers and one sister 
,,dan-burns,Do you have any pets?,use all of the calls personally and when I got married we had as of March two thousand and three and for all of today right at my feet when I was single I do not have a that's because it's very hard to manage 
,,dan-burns,How much free time do you have in your career?,did I have during my career that well this is under way your honor way obviously that's twenty four seven three six five and yours on board the ship and then the importance as bad but you're basically importing your five to your **** Negro is there are and then world shore duty that was the most free time I've had but I was pretty much one of my job war I was a student at the naval postgraduate 
,,dan-burns,Does being a leader give you flexiblity to alter your work schedule?,give me the flexibility to also one of so that's a double edged sword the short answer is yes you are sure you will be a full schedule however if you are the first form the backbone brow read it the day your nose look and be good enough and all of the work up so the old adage that one of my executive all through fast on the was the letter once we ship swore locks all lawful the but if that means you need to put in the five thirty the next morning make sure is to finish the war so this it was a big fan of so they're running all rated four the with the family to be with their friends so they know they can pop off and then I could be a necessarily stick around with my with the fall of people are only knew all the early the best way to do things I thought this was a lot about the schedule at all my professional career 
,,dan-burns,"How does being a leader change your lifestyle?(frequent travel, irregular hours, family difficulties etc)",being aware change your lost all of that your charge one they're gonna sign off on it you can either a zero shifts yeah so there's also so you're responsible if you think you can get away with some we've been looking who's the please maximize understand though that the ship's crew is all life goes on twenty four seven three six five with or without your love do you have have you put in place a lot of checks and balances do you trust to number two there is an all sort of people on the ship and get the ship on the way if either one is ship in two six also very models we had dropped the book reviews for you all good to go and as a lieutenant yeah told moved to shut we've been arm as you can about the movie should be calls we were in the sweet pattern for the cruise ship that was not supposed to do that yeah then he came in and had we not move property with us for so edit it yeah and you're sure you're working so you could affect your travel you know as the the their application you can grow also travel and travel and I'm also in my time I've seen many officers that never left yeah that was one of three have there is a no I did not enjoy it I've got the never left the ship the commander it will never make at and you know you're headed for real large work life balance the 
,,dan-burns,How do your command responsibilities affect your style in personal life?,those also is a personal life your call as many calls your going to get a call off we try to or use any orders and right many losses mission vision so that she covered a lot of brown well normalizes income was one of those really this morning then during officer who is going to say yeah it is also ever and are you what that you want to be called your brother and if you did this in in the you know you walk to all you will recall so when that happens in this present day so so so for what is the use your cell phone will be going off a lot of helpful word folded the whole families at the Jersey Shore we had all three of these ladies of all is that so you need it all the while and you just have to that is expectations well if your spouse or family though eight that is a beautiful model I get a phone call from Michael they all calls we as if if if and at this rate at all except if you will recall 
,,dan-burns,What is a good approach for selecting a new duty station in terms of finding an area for my family to live in?,it serves a try to five little area of war the family will point to a new duty station a lot of resources available to you especially in this day and age with the internet first noticeable finally rolls of dot com will be able to tell you right use of the school so if you have a family that's the number one priority is getting into a good safe school district so you can use that use the internet resources that are available to you there's gonna be a at the base of the representation to help you well frankly there just looking at the internet which you yourself now walk at but I would downplay family services they'll have a lot of people don't know about this every duty station Phyllis services center at let's see we'll have a portable stove available and we feel we start there if you have time to get to do that 
,,dan-burns,What are the things I should prioritize when picking housing?,for a housing noticeable there you know you're you're married you have kids then have you spell sorry life is always going to get you to do a little box and then as far as kids it was school districts but frankly there you can find those on the internet realtor dot com for one will tell you what the best school districts are then you just do a sort of sorts out from there and figure what works for your budget one would say they are all the dot com you can log in all kinds of parameters to shopping lifestyle coffee houses of servers that are and they'll show up on the and it also yeah yeah yeah the reason that house she because I want to pass on that one because you want to know that the your family is safe while you're gone if you happen to get assigned to oversee specifically there of the dangers and whose they are the mad or over one that is an exception and faithfully you might have a choice to live on the base I would say base housing they yeah you don't have to worry if you have a new family you got a young young children model of a solid yeah it's just takes that strain away not knowing are the city hall yeah they're gonna be safe on base housing okay 
,,dan-burns,What options do you have to transfer or change if you or your family needs it?,so right now maybe is the exceptional family member program and if there's special needs then they will keep you in the area that you need to be close to a hospital just for instance one of my shipmates is we have five boys and they all had a good general the the fat in the stomach lining and had that special food bags speak a lot and so he could support you can not the floor a overseas he needed to be in an area where those food bags war available so several family member planning if you have that that's applicable to your family then the navy is going to go out of his way so make that 
,,dan-burns,"How will my relationship with my friends or family members be affected if I take a difficult assignment, and what advice should i give them?",with regards to what's called the silver bullet wars I was so that is so overboard for that's okay sure from one second ship from San Diego to the level of living in the future and for sure was it two years so as a result of that goes overboard I was allowed to go muscle on so regarding that it was was a hardship for yeah they want anyone with a family doing that so but you got to think it through you know so for two years of pain of living on board the ship speeches and you know what I yeah well I got to go travel for and I met my wife there that's a lot of what I was worried that the ad that was worth it on the ship while I was out there I got to see also says that as a C. every port there was I cross the lines what as you get back up four times one fourth of at the C. every quarter there once so as far as John Paul Jones and seeing the name and see the world this the cell about 
,,dan-burns,How early should I get my family involved in the process of planning my next career step?,so how do you get the family involved with the next step the next career stuff so frankly you'd better have you why your significant other why for me styles for may to fall from the get go okay so no matter I go Norfork and then the she was sure from there and figure out where we're going so as we do what should but we're going to a new ports we have to go about selling your so you'll get some house hunting leave and you want to take the family that's about the only this time you want to let everyone know you don't want to come home on a Friday is that how you were moving so San Diego on Monday are you mad or another word for that when we would use that kind of logic I believe communications and happy spouse happy life so definitely keep spouse of all in the kids you know to get kids off called little surprise for one reason they follow you around the world you know they don't want to know that they're moving so as soon as you know you should tell the way that suits you find out you should tell I will say as you get senior in right the shorter time frame that you're going to find that out in fact funniest story though is one in the ages versions will be built in the Reagan years one commanding officers without any graduate but it isn't far wardrobe and what they will gather also log and I will say he was hold fifty four well the skipper for whole fifty three I partner so all skipper for all food before I go to fifty three news so they did a lot of sense fewer news fifty four was of course a non so it's kind of funny the way moves to work out what yours is the one that's already is is just you know as you your senior and now that information as I wish you would also you're also the exactly loss or are you call for well that's not the case if you could see here yeah you're almost a five piece of meat but you know there are times where this work okay so the rubble and is that one of 
,,dan-burns,What has been your favorite place to live? Why?,my favorite place to live every moderate hello for me they're both writers role met my wife there went back to the I was recalled as captain to be the low thirties OC dean of the engineering school where I was a bit for so I am very fond memories of one of my wife they're going back there are living there raising a family there a moderate helpful 
,,dan-burns,What is an example of a conflict you had between your career and family life? How did you learn from it?,it's good for the rational and family life it is so in nineteen eighty nine yes or or eight fifteen years on active duty as a Chicago I've been on for ships and I scream for S. O. okay just refusing to that of small for and so I was very satisfied with what I had the on as it will also and art is not a lot at that point and my second child and Warren and I decided that I would like to see a little bit more so I love my vision I will choose the reserves I served on the fifteen years in the words or all the walls and that's all resolved it was I would use the river at all 
,,dan-burns,What should I get ready to live overseas?,these screening is quite extensive not only for you or for the family also and also is that always use reading if there is a problem with a family member phrases if the family member is exceptional is registered and use of our program then the navy really for always use which you have and that way you could say with your family and swap out with the crew is going across it is one thing that that the navy has tried to do was ships the quantity overseas is is other groups walks okay well I so that so that so yeah also Monex over my distributor sorry for my insurance he was from Japan he was actually he was the chief editor is gonna be XO of those the ship that we were replacing so let him do that and moved his family to San Diego he was a swap that out and he came to the US as five yeah that's all the five so the navy those swap house rule one in the navy will work with you and has a lot of screaming programs available to help you which is your stuff ready with your stuff in storage and movie 
,,dan-burns,What resources should I look for when I know I am moving to a location?,that's when the cracks one moving you know at this point there's a lot of check was that you can use that you can get from you or moving company also maybe has those so I would use those check was I would also go to the internet and download for free Jeff was and check the tracklist as normal one to help you with your you your spouse or significant other you know as you try to make sure you get so one is something you do forget or if you have something in the mail the the the the movie that really shouldn't one is a long term storage you know it's gonna happen so try to get over it try not to let it spoil too much and move on to the next part of the adventure focus on that and not the small things that happened because they all are if you happen 
,,dan-burns,How do you stay in touch with family?,saying because the family now you know you and everyone's got a small from all you can use those smart phones in it's to the ship and as restricted areas but there will be nights when you go on the fantail we will be designated times during the day or during the week and more on Facebook right Texas different from fantastic this is the vice that Star Trek had one who's cool you know well it or maybe we will look at that well we access then we will call for but if you do then the ship will have the wifi that from the grab you know special nickel for you'll be able to have to come back to 
,,dan-burns,How do you ensure your family is taken care of when you are away?,sure the family is taking care of all your way so your family a make sure that all of smartphones rock yeah I have more once that she may need that that they need to reach you wardroom dish the the ship we'll have it always falls within that's responsible for walking back and forth between the crew of the family at home yeah I was bald men can always talk yeah going to see the caller but I have a ball for this but it doesn't work with families and off the ship the designated arms also the it's good for that your spouse reaching your significant other reach out to you in the office 
