Topics,Helpers,Mentor,Question,text,P1,P2,P3,P4,P5,P6,P7,P8,P9,P10,P11,P12,P13,P14,P15,P16,P17,P18,P19,P20,P21,P22,P23,P24,P25"Background, Challenges, Failure",,carlosrios,What is the biggest failure you ever had and what did you learn from it?,"One of my biggest failures that I've had and I've learned from it, I think is when I when I have applied for a position and I have not gotten those and I have to look deep and really understand why that is happened.  I'll go back to the leadership and I'll ask why did I get that position and anything I can do I try to correct and then try again.",What are the failures for which you are the most unhappy?,"Probably, the biggest failure that I've ever had in my life would be the time that I applied for the Naval Academy, that's the United States' main way to produce their admiral oriented officers. So, I applied there as a 22-year old and I got rejected. I joined the nuclear navy in order to have a better chance to go to that school and I was doing really well, I was one of the top students in my class and I was really fit and in shape and I did everything the right way but when it came time to apply, I put that I wanted to do a humanities type job when really the Naval Academy expects you to have a technical job. So I said, ""I think I want to major in economics or something because they can learn languages"" and I didn't think it really mattered what you applied for. The only thing that matters is that you're an officer and then they will send you wherever. So, I thought maybe economics would be, like, a job that I could, like, kind of enjoy, and you know, I like the type of math that they do and, you know, it's kind of business oriented but really, they want electronics technicians and math people and computer science people, you know, more than economics, so. The XO called me and he's like, ""Well, you know, if you would have done that, then maybe we would have considered that."" So, it feels like, ever since that day, I should, like, I wanted to go back in time and kind of change what I put on my recommendation so that I could've actually went to this really high level school and it didn't work out that way. So, instead I was a nuclear technician for eight years and I learned lots of things. I'm very happy for the job that I eventually did instead but if I had to do it again, then I guess I would have tried to make a better shot for the Naval Academy.",What failures make you the most upset?,What defeat makes you the most distressed?,Tell me about your most upsetting shortcoming.,Describe a time you failed.,For what failure do you have the most regret?,Can you tell me about a major failure you've had?,What has been your saddest time in life?,What made you sad?,What was the saddest time in your life?,saddest moment of your life?,,,,,,,,,,,,,Background,,carlosrios,What is your current position and how did you get there?,"My current position is logistics lead supporting three separate projects. I got here as soon as I retired out of the marine corps.  I applied at a job fair or provided my resume at a job fair to a company that was looking for someone who understood the maintenance of our marine corps systems and understood the language or the procedures within the marine corps.  A couple days after I provided the resume I got called up.  I eventually, actually moved to South Carolina I had an interview.  The owner of the company felt that I was a good fit for the position.  I initially started that position contract support, on the project supporting another government person, that individual couple about six months later decided he was gonna move to somewhere else and they offered me the position.",What do you do now?,How did you get to your current role?,Describe your steps in reaching your current position.,What was your process getting to your current position?,How did you get where you are today in your career?,What do you currently do and how did you get here?,Where do you work now?,What is your job right now?,what is your job today?,What is your career?,Tell me about your career.,Tell me about your current work.,what is your job?,what do you do for a living?,what are you doing in college?,Tell me more about your current work.,,,,,,,,,Background,,carlosrios,How did you choose your field?,"The way that I chose logistics as a career had to do with what I've learned throughout the marine corps.  As a maintenance material officer, my job was to manage aircraft, to manage material, to get products, aircraft for one place to another.  Same thing when I was artillery, when I was younger, early in my career I had the opportunity to work a little bit in the supply fields, so eventually I was able to add all that to my resume and I had that experience and that led into this field, logistics.",What made you choose this field?,How did you make a decision to go into this field?,How do you decide that this is the profession you want to make a career in?,,,,,,,,,,,,,,,,,,,,,,Background,,carlosrios,What is your plan to reach your career/life goal?,"My career and life goal currently right now is I have a 7 year career, or plan.  My intent is hopefully moving from this to the next level as a product manager within the organization I currently work in that's probably managing couple more projects and after that probably in the supervisory role in the near future. That seven year, my intent is to finish my career in seven years and completely retire and now balance a little bit with my personal life.",How do you plan to reach your goals?,Do you have a plan for your future goals?,Where to you want to be and how do you plan to get there?,What are your long term goals?,How do you intend to achieve your long term goals?,What are you going to do to complete your career or life goals?,What is your plan for continuing your career?,How will you get where you want to go?,,,,,,,,,,,,,,,,,"Background, Education",,carlosrios,What were some of your fears entering college and your career?,"My fears in entering college was different than when a kid first finishes high school and goes to college.  He doesn't know anything, or she doesn't know anything.  It's a new world for them.  In my case I was already an adult, I was already working, so my greatest fear was, Can I do that? Can I raise a family go to work and also have time to go to college? And it was difficult but I had a very good support team helping me every day from my family to my friends and my coworkers.",Did you have fears going into college or your career?,What were you afraid of before you went to college?,Were you worried about anything when you were entering college or your career?,What concerns did you have prior to entering college and your career?,What were you fearful of before beginning college and your career?,what were you scared of going into college?,,,,,,,,,,,,,,,,,,,"Background, Internships",,carlosrios,What internships did you have? How did they prepare you?,I didn't have no internships.,Did you have any internships?,How did your internships prepare you for your career?,In what ways did your internship experience transfer to your real work?,Did you have any valuable internship experiences?,Were your internships valuable in preparing you for your career?,is this your first internship?,tell me about your internships.,are you an intern?,What did you do at USC?,,,,,,,,,,,,,,,,"Background, Challenges",,carlosrios,What challenges did you face and how did you overcome them?,"I faced several challenges throughout my life and overcoming, coming them all up tend to be the same thing, there's a challenge and or the way I overcome those challenges tend to be the same mindset.  There's a challenge and my goal is to get over it and continue moving forward and not allowing it to keep me back.",What challenges did you face and how could you defeat them?,How did you conquer over the many hurdles you faced in life? ,Can you share some of the major hurdles or hard times you overcame?,,,,,,,,,,,,,,,,,,,,,,Background,,carlosrios,What used to be your biggest weaknesses?,"My biggest weakness that I used to have and now I've overcome I think is I was more of an introvert when I was growing up.  I was a lot quieter, I think prior to coming to the marine corps and then I think the marine corps actually brought out of me those traits that make you successful in life. Again, I'm very involved. At work sometime I joke around and call myself a social butterfly.",What were you bad at and how did you fix it?,How have you improved your negative qualities?,What did you do to improve your weaknesses?,What are your greatest weaknesses?,How have you worked on your weaknesses?,What are you the worst at?,,,,,,,,,,,,,,,,,,,Background,,carlosrios,How have your priorities changed as your career progresses?,"My priorities have changed or evolved throughout my career and my life differently.  Initially in the marine corps I was very focused on the mission at hand to a point that I couldn't balance my personal and my professional life.  I was a marine and that was a priority. I would leave for six months I would come home for a couple months just to turn right back around and go continue to serve.  So there wasn't great balance there.  As I've gotten older and now especially where I'm at now, I find it easier for myself to find balance. I can balance my work and I can balance my professional, my personal life.",Have your priorities changed throughout your development?,In what ways have your priorities adapted to your career situation?,What priorities do you have now that you didn't have earlier in your career?,Do you think differently now than you did at the start of your career?,Has your work shaped your priorities?,,,,,,,,,,,,,,,,,,,,Future,,carlosrios,Where do you see yourself in 5 years?,"I see myself in ten years, retired, living in an apartment condo somewhere in front of the beach.",What do you think you'll be doing in the next 5 years?,What is your plan for the next 5 years?,,,,,,,,,,,,,,,,,,,,,,,Miscellaneous,,carlosrios,What do you like to do the most?,"I mostly like playing with the new technology.  If it comes out today I'm probably one of the first ones that like to buy it, to see what it does.  Technology has always fascinated me, so now that I'm in a position where I can afford some of these new toys I tend to be the first one who will buy them and I play with them.  I'll see what they can do, but that allowed me to continue to grow even in my professional career.",What do you enjoy doing?,What are your favorite things to do?,Do you have any favorite activities or work?,What things do you prefer to do?,What are the most fun things you do?,Are some things more fun for you than others?,what makes you happy?,what makes you smile?,What is something that makes you smile?,,,,,,,,,,,,,,,,"Lifestyle, Military",,carlosrios,How has your job affected your lifestyle?,"My current job has affected my life style in a positive way.  Now I have the opportunity and the flexibility to indulge in some of those things I wanted to do when I was younger.  I like to go fishing, I like to be on a boat.  I have friends that we hang out a lot more than we used to when we were in the marine corps.  But again it was a different life when I was a marine. I tend to spend a lot of time focusing and committed and my hours were a whole lot longer when I was a marine.",How does the Navy impact your lifestyle?,Does the Navy largely affect the way you live?,Is the Navy lifestyle difficult?,How is the Navy lifestyle different?,How's Navy life different?,What's Navy life like?,,,,,,,,,,,,,,,,,,,Future,,carlosrios,What do you plan to do until you retire?,"Professionally I tend to want to continue to educate myself, continue to gain experience in my field, meet a lot of interesting folks and then when I retire I tend to hopefully pass whatever I learned on to the next guy and then move on.",What do you intend to do until the point that you resign?,What is your plan to do before you retire?,Do you have any specific thing that you'd like to do before you retire?,,,,,,,,,,,,,,,,,,,,,,Future,,carlosrios,What is your career goal?,"My current career goal is to continue to move up the chain of command, hopefully be a product manager for the team and then eventually get into a supervisory position, and then spend the next couple years figuring out how can pass whatever I learned to those that come after me.",What is your profession objective?,What do you want to achieve in your career?,,,,,,,,,,,,,,,,,,,,,,,"Miscellaneous, Decisions",,carlosrios,"If you weren't doing this, what do you think you would like to do?",I've always wanted to be a marine. I am a marine and never lose that title. The current position I got as a logistic lead if I wasn't doing this what I would have liked to do? I would've probably stayed in the marine corps.,What would you be doing if not this?,"On the off chance that you weren't doing this, what do you figure you might want to do?","If not this, what would you be doing?",,,,,,,,,,,,,,,,,,,,,,"Military, Management",Navy,carlosrios,Can you change branches? Can you switch to the Army or Air Force?,You always have an opportunity to change services if you wanted to. I've known a couple that didn't have the opportunity to continue on the current service they were in and decided to do a change. Or they were offered another opportunity in another service. I've seen people go from the marine corps to the army. I have seen people come in from other services into the marine corps.,Can I switch branches once I am in?,Does the military allow you to switch branches?,Can I change from Navy to Air Force?,Can I become a Marine if I join the Navy?,How can you switch branches in the military?,,,,,,,,,,,,,,,,,,,,"Military, Management",Navy,carlosrios,Can I change my job if I don't like it?,"If I didn't like what I was doing today and I want to change my job in the current employer that I'm with, I would just put in a request and see what's available. If it required me to resubmit for interview then I would do that. If I didn't have to do it they would do what's called a lateral move which is, they give me an opportunity another position without it being compete.",How to leave a job that I do not like for another job?,How can I choose the job I am interested in?,,,,,,,,,,,,,,,,,,,,,,,"JobSpecific, Demographics, Culture",Navy,carlosrios,What is the diversity of people like in the Navy?,There's a joke in the marine corps where we say everyone's green but we're so diverse in the marine corps and I think we've learned that the importance of that diversity that continues to make a successful is there was always room for growth ofcourse there is. But I don't have never been in another organization that was as diverse as the marine corps.,How is the decent variety of individuals in the Navy?,Do you think Navy has a broad variety of people?,Does Navy has people from different backgrounds?,,,,,,,,,,,,,,,,,,,,,,"JobSpecific, Demographics, Culture",Navy,carlosrios,What is the diversity of religion in the Navy?,There's a great diversity of religion or freedom of religion in the marine corps.,What is the decent variety of religion in the Navy?,Do you think Navy has people from broad variety of relegion?,Does Navy has people from different relegions?,,,,,,,,,,,,,,,,,,,,,,"JobSpecific, Demographics, Culture",Navy,carlosrios,What is the ratio of guys vs. girls in your area?,I don't know the actual number.,What is the gender ratio in your work?,Does your area of work have a good gender ratio?,Do you think your area of work is gender diverse?,,,,,,,,,,,,,,,,,,,,,,"Military, Culture",Navy,carlosrios,Can you date other people who are also working with the Navy?,In the military their rules and regulations that dictate their relationship with service members in the organization such a friend.,Would you be able to date other individuals who are additionally working with the Navy?,Can you be romantically involved with your colleagues?,,,,,,,,,,,,,,,,,,,,,,,"Military, Culture",Navy,carlosrios,Is sexual harassment common at the workplace?,"I'm sorry, I couldn't you. I can't give you an answer on that one only because I can give you stats or anything that what if it's common that it's not but it happened. So, I don't know how to answer.",How common is sexual harassment in the service?,Is it normal for women to get sexually abused in the military?,Will I be harassed if I join the military?,How many people do you know who have been sexually harassed while in the military?,Do a lot of people experience sexual abuse in the military?,,,,,,,,,,,,,,,,,,,,"Military, Culture",Navy,carlosrios,How do you stay in touch with family?,"When I was in the marine corps I stayed in touch with my family by mail. I would write a letter and it would take forever to get to them. Unlike we do today Facebook, people have instant communication with the family members. As years went by, it got better and better we were able to make phone calls. We used Payphones at one time and then we started using cellphones and of course video, were able to use a computer with a video such as Skype or an iPad.",How do you make sure you are connected with your family?,How do you keep in contact with your famiy?,Do you stay in regular contact with your family?,,,,,,,,,,,,,,,,,,,,,,"Military, Culture",Navy,carlosrios,Are there too many or too few people entering your profession?,Due to the broadness of this field or logistics there's always people coming in at different levels and it's always good to see the young men and women picking logistics as a field and picking specific jobs within that field.,Does this field have a lack of talent?,Does this field need more workers?,Is your profession short on hires?,How many people are going into your career?,Does this field need me?,,,,,,,,,,,,,,,,,,,,"Military, Culture",Navy,carlosrios,What sorts of changes are occurring in your occupation?,"The current changes that are happening in our field especially logistics have to do with the advancement of technology, the ability to be able to communicate with a customer just by picking up a phone a cell phone. And now our customer went from having laptops now one iPad or some type of tablet to communicate to some type of watch.",Is this field changing?,Is this career or profession changing?,How is this profession changing?,Is this field different than it used to be?,How different will this field be when I get into it?,What changes can I expect to see in this field?,How is computer science changing?,What is the future of computer science?,,,,,,,,,,,,,,,,,"Military, Culture",Navy,carlosrios,Which sectors of your career are expanding?,Sectors in our career that are currently expanding have to do with technology. One of the biggest one that I see a lot of people coming into a cyber security. People want to feel safe when they get on these systems. I want to be able to deploy a system and know that it's.,Which divisions of your profession are growing?,Are there any sectors of your field that are growing?,,,,,,,,,,,,,,,,,,,,,,,"Military, Culture",Navy,carlosrios,How do you proactively prepare for a decline in your field?,"To be proactively prepare for a decline in our field always has to do with understanding what where your field is going to and your education. And continuously learn new ways, how to do things or the next step in your career.",What if this field declines?,In what ways do you get ready for a decline in your career field?,How do you handle declines in your field?,Is there anything you do to prepare for a decline in your field?,How do you ensure security if your field becomes outdated?,,,,,,,,,,,,,,,,,,,,"Military, Culture",Navy,carlosrios,What do you believe will be the most important factors that will shape your future?,"Important factors that I think will shape the rest of my career or the next step in my career will have to be my personal life. As things get, my children leave the house and then I have a little bit more freedom to be able to move without impacting their life.",How do you see the factors influencing your future?,What factors do you forsee impacting your future?,Are there any factors you think will change your future?,What factors do you predict will play a role in your future?,What things does your future depend on?,What circumstances do you think will decide the future?,,,,,,,,,,,,,,,,,,,"Military, Culture","Navy, Positive",carlosrios,What was the coolest thing you did in the Navy?,The coolest thing that I've done in the marine corps has been supporting the V22-Osprey.,Do you have any sick stories about your Navy career?,Did you get to do cool stuff in the Navy?,What cool things did you do in the Navy?,Is being in the Navy fun?,Did you have fun in the navy?,What sticks out to you as an awesome Navy experience?,what was the most interesting thing you did in the navy?,What was your favorite memory while in the military?,What is your favorite memory?,what is the coolest thing you have done with the navy,what was the most coolest thing that happened to youn in the navy?,,,,,,,,,,,,,,"Military, Culture",,carlosrios,Which sectors of your career are dying out?,I have no idea.,Which segments of your profession are vanishing?,What parts of your field are going to die?,,,,,,,,,,,,,,,,,,,,,,,"Advice, Change, Challenges",,carlosrios,How do you react to change in your field?,I react positively to changes in my field which is important to individuals in our field you have to be flexible and that'll make you a better team member.,How would you respond to change in your field?,How do you cope with change?,,,,,,,,,,,,,,,,,,,,,,,"Military, Future",Navy,carlosrios,What do you think the future of this occupational area is?,"I think the future to this area that I am currently in is very bright. I think it continues to grow, people always gonna need something. They always gonna need support. I think there's other are organizations out there that are doing it and are getting better and better at it.",What do you think the eventual fate of this field is?,Can you predict the future scope of this field of work?,,,,,,,,,,,,,,,,,,,,,,,"Military, Future",Navy,carlosrios,How does this field's future growth affect me?,The future growth of this field or logistics impacts everyone. I give you more opportunity and again the broadness of what you can do in logistics will continue give you options and as a young adult in coming out of high school.,How does this field's future development influence me?,How do you think this field's growth will impact me?,,,,,,,,,,,,,,,,,,,,,,,"Military, Future",Navy,carlosrios,What technical innovations on the horizon could obviate the need for this field?,"Technical innovations that are currently happening now is all about transportation. The ability to be able to get something from here to somewhere else quicker. Couple of months ago, Tesla was able to actually land a rocket booster back that it used. That previously NASA couldn't do, that's amazing. The cost lowered the cost for the ability to be able to send something to the space station and bring actually the boosters back, that was amazing. And I think as that gets better and better one day will be able to send something from here to the other side of the world quicker than we have ever had before.",What specialized developments not too far off could block the requirement for this field?,Can you list some technical innovations that this field is about to see?,Are there any innovations that are on the brink of coming to life related to this field?,,,,,,,,,,,,,,,,,,,,,,"Military, Future",Navy,carlosrios,What is this field's tempo of change(increasing or decreasing)?,I think the tempo in this field or logistics continue to increase as we get better and doing things and request for support are not only in this country and other countries it'll continue to grow and give us more opportunities to demonstrate and grow in this field.,At what pace do you think this field is changing?,Is this field changing really fast?,,,,,,,,,,,,,,,,,,,,,,,"Military, Future",Navy,carlosrios,What part of your future are you most worried about?,Getting my kids to college.,What part of your future would you say you are most stressed about?,Do you have any thing that you are worried about for the future?,,,,,,,,,,,,,,,,,,,,,,,"Challenges, JobSpecific",,carlosrios,How do you handle fatigue at work?,I normally handle fatigue by getting up from my chair walking around having discussions with the other coworkers and then refreshing myself and coming back and start focusing on what I was doing.,Should I drink caffeinated drinks to stay awake?,How do you stay awake when you are tired at work?,Do you often get sleepy at work?,Is work exhausting?,How do you manage exhaustion at work?,What are your strategies for overcoming fatigue?,,,,,,,,,,,,,,,,,,,"Military, Decision, Advice, Culture",Navy,carlosrios,What branch of the military should I go into?,The branch of the military that you should be going to do is dependent on what your goals are going to be. If you decide you want to go to the medical field then maybe you want to do the navy or the airforce. In the marine corps we don't have any medical field so you might want to do the navy so it's dependent on each person.,Which branch is the best?,How do I decide what branch to go into?,What branches of the military can I go into?,What are the best branches of the military?,Which branch of the military should I join?,How do I decide which part of the military to go into?,What about the army?,,,,,,,,,,,,,,,,,,