Topics,Helpers,Mentor,Question,text,P1,P2,P3,P4,P5,P6,P7,P8,P9,P10,P11,P12,P13,P14,P15,P16,P17,P18,P19,P20,P21,P22,P23,P24,P25"JobSpecific, Advice",,carlosrios,What is dress attire for this career?,"Currently the dress attire in my current field is business casual.  Fridays we're little bit more relaxed, I think we'll wear jeans.  But mostly business casual unless we have our customers who are gonna come for a meeting or we're gonna have a meeting with our senior leadership then at that point we'll probably dress better.",can you tell me when you wear which uniforms?,what do all the uniforms mean?,do you get different uniforms as you are promoted?,does the Navy buy all your uniforms?,do you always have to wear a uniform?,,,,,,,,,,,,,,,,,,,,"JobSpecific, Advice",,carlosrios,To what extent does this organization adhere to tight schedules both long term and daily?,"The current organization that I am employed with tend to manage the day to day effort via schedules, long term and short term.  And they're very important because everything we do, it's a requirement for our customer.  They might give us a requirement that's due a year from now while we write that date down and then we backtrack on everything we need to do to achieve that end state.  We use schedules, a master schedule that'll track every day in everything we completed so a year from now, 365 days later we can actually say we're at our milestone.",are you time constrained in what you do every day or across your entire career?,is there any slack built into your work day?,how important is time management in the Navy?,Is it okay to be late?,,,,,,,,,,,,,,,,,,,,,"JobSpecific, Advice",,carlosrios,How can I request to work in a certain area or field?,"So assuming that you want to change fields, your commander will always give an opportunity to find where you might make the biggest impact and, again they might not be your first choice, maybe not your second choice, but your command will try to put you in a position where you're going to be successful.",how likely is it that I will get to do what I want to do?,will the Navy assigned me to something I hate to do?,can I do another job if I don't like mine?,are jobs in the Navy permanent?,,,,,,,,,,,,,,,,,,,,,"Training, Military",,carlosrios,What was the most difficult part of your training?,"The most difficult part of the initial training, again it was all about trying to understand the processes in an organization that I joined, was trying to retain so much information in a short time.  At the end of the day, especially as a contractor, I had a year, my contract was for one year, every year you will get renewed, so you have a short time, you got twelve months to start.  You have to learn something then you have to start applying in providing your customer and your supervisors a deliverable.",what is the toughest thing to learn?,what was hard for you to master?,was there a time when you had trouble learning a new skill?,what did you struggle with when joining the military?,Was it hard to learn what you learned?,what was hard for you to learn for the Navy?,,,,,,,,,,,,,,,,,,,"Military, Culture",,carlosrios,What is the most difficult part of logistics?,"The most difficult part of logistics is, with such a broad field, we go from transportation and shipping, handling of a material, acquisitions, actually buying something in procuring a product, this field in it, testing it, getting it to our customer.  So we're so broad in the field, the difficult part is you want to become the ""Jack of all trades"" and at the end of day the master of all those fields, and again it's very extensive list, the more of them you become, the more parts of it just become better at, the better, the easier it become for you to see the big picture in how logistics supports our economy.",which part of logistics is the toughest to learn?,is there something about this career that is very hard to do?,what is the hardest thing about what you do?,is what you do hard?,do you have to study a lot for logistics?,do you have to study a lot?,,,,,,,,,,,,,,,,,,,"Military, Culture",,carlosrios,How would you describe your work culture?,"The way I would describe our work culture, would be we're very close I think because as a team we succeed I think when we try to be an individual, most of us have a lot of military background, we understand how the military works, so that culture tend to be focused on a mission and knowing that whatever we do today will impact our our forces out in the country so that the our culture tends to be tighter then some other organizations.",how do you view the way you and your buddies approach your jobs every day?,do your friends enjoy what they do?,is you job filled with pressure or characterized by cooperation and camaraderie?,are you close with other sailors or soldiers?,does the Navy have a specific culture?,Tell me about navy life.,what is Navy life like?,What was the most fun you have ever had?,,,,,,,,,,,,,,,,,"Military, Money",,carlosrios,How does an officer's/non-officer's salary compare to civilian salaries?,"A comparison on my former career marine, enlist in an officer to the salary compared to now, think is a little, I'd say it's a lot different I would say when I was a marine, I really was on I was on duty twenty four hours a day seven days a week, while here in my current status, or my current job, I'm working eight hours a day, forty hours a week, maybe I'll add a couple hours to it, but at the end of the day I worked a lot more hours so I would say that my salary now it's a lot more than when I was a man in the millitary.",will my pay be better or worse than that of a civilian?,what is the pay like outside the military?,will I make more or less than non-military people?,will I make more money if I join the military?,,,,,,,,,,,,,,,,,,,,,JobSpecific,,carlosrios,How significant is there a chance of being deployed?,"The a chance of being deployed while you're on active duty or even a reservist are very likely that to we do, I I think that someone asked me a long time ago, ""do we really like going to war I don't really like going to war or deploying in becoming and being fort and readiness"" but just like a doctor needs patients, we in the military have a purpose, and our purpose is to deploy in defense of this country so it's very likely and you get a lot of experience from deployment, it's not like if you're just going to be on a boat, you're gonna be on land and one spot and you're not doing anything, that I think you get a lot of training, get a lot of experience and you get to travel the world.",how often do you go to sea?,will I get deployed?,how much will I be away from my family?,does everyone get deployed?,do I have to leave home if I am in the military?,,,,,,,,,,,,,,,,,,,,JobSpecific,,carlosrios,What things are there for me to do on a ship?,"Whil deployed, there's plenty of things to do on the ship, you can work out a lot I think, when I had the opportunity I would go to the gym, my mornings for start, of course you work eight hours, maybe longer because you're on a ship and you have more time on your hands, you that don't have that traffic to drive home, your room might be one deck down or it might just be next to where your offices at, but in the end of the day you can go to the gym when you're not working, you can go and study, there's school there's some of our officers that also teach some of the college courses while they're on ship, in fact some of my college courses for my degree I got when I was on ship and deployed, you have more time to study, and then of course you have an opportunity to do some recreation or even running while you're on the flight deck on top and you can do a couple of miles there.","if I am at sea, what can I do to relax?",is there free time to do stuff on a ship?,what kinds of break activity is there at sea?,Is a ship boring?,how do you cure boredom on a ship?,what do you do for fun on a ship?,do you watch tv or movies on a ship?,What tv shows do you watch?,How do you cure boredom on the ship?,,,,,,,,,,,,,,,,JobSpecific,,carlosrios,Why should someone choose to work with the Marines?,"I've been always asked, ""why does someone become a marine or why should someone become a marine, "" My response is if you want to be the best you become a marine.",give me good reasons to enlist.,how is a Navy career rewarding?,what makes a career like yours worthwhile?,why should I join?,what is a good reason to join?,why should I join the Navy?,Why should I go into the Navy?,Are you patriotic?,,,,,,,,,,,,,,,,,JobSpecific,,carlosrios,Why should someone choose to go into logistics?,"The reason I chose to be logistics, I like the flexibility, I like the opportunities, again logistics is a broad field and you can one day be working on shipping, next day you can be handling inventory, next day you can be in the acquisition field, so the reason I picked logistics, it's because the broad and the opportunities throughout the actual career and %HESITATION most of people like that flexibility.",what is so good about logistics?,why are business in logistics a good area?,what is the benefit of going into a logistics business?,why technology?,why STEM?,Why did you choose STEM?,What made you decide that STEM was for you?,,,,,,,,,,,,,,,,,,JobSpecific,,carlosrios,What are the long-term impacts of STEM fields?,"The long term impact of the stem field, science, technology, engineering, and math, or medicine.  I think they're important and why because that's where we're headed to. I think the more difficult these careers have become, the more our students are learning early on and going to early education with they're teaching them higher math and maybe then I was getting, but at the end of day, it's important we keep it advancing technology keeps growing. I think we're very fortunate, most of it starts here in the United States, but at the end of day, the better we're familiar with, the less we're scared of this new technology the more of our kids are provided introduction into tech into stem fields the better, the more we're gonna succeed at and that will continue to be a leader in the stem fields.","how will I make a difference?",does STEM change the world?,what mark can I leave doing this work?,,,,,,,,,,,,,,,,,,,,,,JobSpecific,,carlosrios,How do you and your work colleagues socialize outside of work?,"Myself and my colleagues, normally every Friday after a long week of working very hard for our customer, ensuring we provide them the required support, we might have to work, we all go in and have a maybe something to eat or something to drink and we'll would just spend the day outside work, but again after that day I'll go back home and I like balancing it between my work and of course my personal life with my family.",is there a lot of friendships among your colleagues?,do you guys go drinking together?,do your work colleagues' and their families get together?,what is the social sphere like?,is work social and friendly?,how did you make friends in the Navy?,do you get along with your coworkers?,do you get along with other people in the Navy?,do you like who you work with?,How did you meet new people in the Navy?,,,,,,,,,,,,,,,JobSpecific,,carlosrios,What is the gender mix of your workplace?,"The gender makes of our workplace, I think it's highly, it's highly male dominated, there are females and it's only getting better as we continue to stress the importance of STEM for our females, young ladies in school as we're starting to address science, technology, engineering, and math in medicine in the lower school so the kids can start growing into those field early on or having an interest in those fields.",how many guys and how many ladies at work?,is there a decent mix of men and women in the service?,are there many of both sexes where you have been assigned?,are any girls in the Navy?,what is the gender ratio of the Navy?,is there a gender distribution in the military?,do you work with any girls?,have you met girls in the Navy?,can women join the Navy?,,,,,,,,,,,,,,,,JobSpecific,,carlosrios,What are the ethnic percentages of your workplace?,"The ethnic percentages in our workplace are getting better, they're nowhere near where they should be.  It's import to have a very diverse work force, I think we think better, I think where not all thinking the same thing and we're all thinking from different directions in different experiences and that diversity is what made this country great and what's gonna continue to make successful our missions supporting our customer, so that mix is nowhere where it should be, but something we continue to address by programs like these and any of these stem program when we go to out reach schools at early on in our kids education.",are people at work from all races?,is there any segregation by race?,what is the breakdown of race and national origin in the workplace?,Is your work racially diverse?,Are you the only black guy in the Navy?,Did you know other races in the Navy?,Is the Navy racially diverse?,What is the African American experience in the Navy?,,,,,,,,,,,,,,,,,JobSpecific,"Navy, Negative",carlosrios,Why do people leave this field or company?,"Some people leave our current job, or our current field, or my current employer, only because they find that after gaining so much experience they decide they want to do something else.  Again, everything's a stepping stone for the next chapter in it individuals are life or or novel.",what makes people want to quit?,is there a reason that drives personnel to leave the service?,why do so many people leave the military?,what reasons are there to leave the Navy?,,,,,,,,,,,,,,,,,,,,,JobSpecific,"Navy, Negative",carlosrios,Why do people leave the logistics field?,"One of the changes that a lot of logisticians are starting to make in this field is they're starting to gravitate towards the engineering field.  We're very related, when it comes to a field and I think, of course the different is the schooling that most of us have, all the certification, but we worked so much with our engineers that we start ourselves or the logisticians started getting that experience and they start finding that a logistician who has an engineering or an engineer that has a logistic experience is a gold mine, it's a tool that that makes him even more successful.",do people get tired of it?,is technology a field that keep people for a long time?,do people leave the STEM field?,what if I get bored with STEM?,What is difficult about logistics business?,,,,,,,,,,,,,,,,,,,,"JobSpecific, Lifestyle, Military",,carlosrios,"How will my relationship with my friends or family members be affected if I join the navy, and what advice should i give them?","So the impact of the relationship between you and your family when you join in the Marines. It varies, some parents are very proud, some family members are proud that their child decides to be a marine or even serving our country, but at the same token they're very worried, they would like their job their son or daughter to go to college first or what not but it's all dependent on the communication between the soon to be marine or the service member and the parent.",can my being in the Navy worry my family and friends?,how do I tell my family or parents that I am joining the military?,what should I tell my folks about the Navy?,will my relationships suffer from being in the Navy?,"being in the navy, is it difficult for you to have a relationship?",can you have a relationship in the Navy?,what do you tell your family?,will my family be worried about me?,what will my family think of the military?,What did your parents want you to do?,What do your parents think about your career?,,,,,,,,,,,,,,"Military, Growth/learning, Culture",,carlosrios,How much value does your organization put on education and training?,"My current employer places a lot of value on education by providing, it's important for them, it increases the potential of new customers when a customer understands that we have the right skill sets within our work force, it brings more customers and they bring customers, but at the end that day it provides us an opportunity to succeed the smart of our workforce.",Does your organization put value in education and training?,What can you tell about your organization's policy on training and educational development?,,,,,,,,,,,,,,,,,,,,,,,"Military, Benefits, Education",,carlosrios,How do the educational benefits of the military work?,"Currently, the marine corps provided me an opportunity sign up for the Montgomery GI bill, which allowed me to have funds to pay for college.  Initially, while I was in the marine corps, they allowed me to go to school, and they provided me a fund so I can work on my degree while I was working and then once I retired I was able to take those same funds and transfer them over to my son so he could pay for his college.",describe my chances of getting education in the Navy.,does the military pay for your college?,how can I pay for school and join the military?,how do I receive the military educational benefits?,is education free after serving in the miltary?,how much does the military pay for college?,should I go into the Navy for free education?,tell me about the education benefits in the Navy.,,,,,,,,,,,,,,,,,"Military, Benefits, Education",,carlosrios,How can I get financial help from the navy for an advanced degree?,"The military or the marine corps will constantly find ways to ensure that you have every opportunity to increase your education from an undergraduate, to a graduate and higher and you're only limited by yourself.",How to fund my studies?,How to find loans for my advanced studies?,,,,,,,,,,,,,,,,,,,,,,,JobSpecific,,carlosrios,How can I switch jobs if I don't like what i do?,"If I wanted to switch from logistics maybe to the finance world, all I would do is apply for those positions.  It would behoove me to initially educate myself in that position and start doing some on the job training or OJT and then ensure myself that I'm understanding the intent or the deliverables required for that position or the skill set and then meeting the right people so they can help me and mentor guide me to that field.  Once I think I have enough experience then I'll start applying for those positions.",How to leave a job that I do not like for another job?,How can I choose the job I am interested in?,,,,,,,,,,,,,,,,,,,,,,,"Growth/learning, Future",,carlosrios,What is the advancement potential in the field? What is a typical path?,"The advancement opportunities in my field, where my current position I'm currently leading three projects, but my direct supervisor he's leading what we call an IPT, that next level is managing nine projects for nine logisticians who each might be managing three programs and then so on and so on, so my next position might be a product team manager, the next level, and then after that maybe I want to become a actually supervisor of the work force within our organization.",how do you get promoted?,can I impact how soon I get advanced?,how does advancement work?,is it common to be promoted?,,,,,,,,,,,,,,,,,,,,,"Opportunities, JobSpecific, Military, STEM",Navy,carlosrios,What are the opportunities for advancement in this career?,"Advancement in my career in my field, tend to, I said from the beginning that we are such a broad field that I couldn't, for me advancement for what I'm doing now would be, a product team manager which is the next level up, and then eventually a supervisor, but at the end and then there's four other levels of supervision, level one to level four, supervisor which is a M4 and then level 3,2 and 1, again it's a pyramid type of leadership but at the end of the day, one leads to the other or the expectation is that as you get expansion one level, you have enough experience other than that time in that field until that you can move to the next level.",Are there any opportunities for advancement in this career?,What can you tell me about some opportunities of career advancement that this field provides?,,,,,,,,,,,,,,,,,,,,,,,"Opportunities, JobSpecific, Military, STEM",Navy,carlosrios,How will my experience transfer to civilian jobs outside of the Navy?,"The way your current job in the marine corps or the military transfers over to a civilian job has to be done with planning.  When I initially started in the marine corps I started in artillery, I can't see too much of a use for an artillery man in the civilian sector but that eventually, I moved from that job and then went into aviation and I became a maintenance manager of aircraft repair and from that, that lead into my civilian job, my initial a reason why I got hired by as a contractor was because my understanding of maintenance practices in the marine corps.  That eventually led to my next position and now I manage three programs and two of those programs actually have to do with artillery.",is this training useful in civilian life?,will this help me get a good job when I get out?,do employers like to hire veterans?,will my Navy skills transfer to civilian life?,,,,,,,,,,,,,,,,,,,,,"Military, Culture",Navy,carlosrios,What is a story that really shows what it is like working in your job?,"An example of one of the stories I can give you, working in my current field and providing my customer support: We just had a refresh or the marine corps decided that they needed 2600 systems or laptop cases, printers and some other peripherals, and they had give us a short opportunity to do this and we spent about a year developing that system and then we took another couple months, getting at that system ready for shipping, to include we created transit cases, inserts, and then of course software.  Once we develop that system then we spent about another six months shipping that gear to the unit and then provided them throughout the whole marine corps, that included California, the east coast, west coast, our reserve unit and out overseas units, but it's a very fast pace, very fast paced.","tell me a good ""sea story"" that reveals the real Navy.",is there some tale that would help me understand the Navy life?,are there experiences you have had that exemplify a Navy career?,,,,,,,,,,,,,,,,,,,,,,"Advice, Management",Navy,carlosrios,How do you handle supervisors who were unable or unwilling to give you feedback? (asked: How do you get good feedback?),"In order for me to get good feedback from my customer or my supervisors, there's opportunities, there's time they have to give you feedback, at the beginning of a process, at the end of the process, your supervisor, your leadership supposed to give you feedback every three to six months and actually call you in and discuss your performance, but you request that feedback and more often than not.",How would you deal with directors who were not able or unwilling to give you input?,How might you manage chiefs who were not capable or unwilling to give you input?,By what method may you oversee boss who were not proficient or unwilling to give you input?,,,,,,,,,,,,,,,,,,,,,,"Decisions, Management",,carlosrios,What are the most important decisions that you face daily as a leader in your organization?,"The most important decisions I feel that I make throughout the day as a leader is the well being of my support, the team that we currently work with and their opportunities to continue to advance.  Some of our contracts end and then they have to either move on or we try to find other positions for them, and we're very successful in doing that, and you build relationships with your team, you wanna make sure of their well being not only professional but also personal.",tell me about tough choices you have had to make.,what kinds of command decisions have fallen into your lap?,"do you have to make critical decisions and, if so, what kinds?",what major decisions have you faced in the military?,,,,,,,,,,,,,,,,,,,,,STEM,,carlosrios,What is a STEM career like?,"STEM careers tend to be very challenging, very fulfiling, of course there are benefits to be in a STEM career, a science, technology, engineering, math, or medicine, so again they're very fulfilling they're very challenging.",Tell me about being in a STEM career.,What is it actually like being in a STEM field?,What do STEM majors actually do?,What do you do in a CS or STEM career?,,,,,,,,,,,,,,,,,,,,,STEM,,carlosrios,What are the different STEM careers?,"There's a variety of stem careers, technology wise, engineering of course, engineering itself, there's a different types of engineers or fields that you can participate in from civilian to military, aviation engineers, so there are quite a few of them, environmental, medicine and the list goes on and on.",What can I do in STEM?,What are my options for STEM?,Tell me about the opportunities available to STEM majors.,What can I do as a STEM worker?,,,,,,,,,,,,,,,,,,,,,"STEM, Military",,carlosrios,What STEM positions are available in the military?,"No different than the civilian sector, the military has its share of STEM fields that we can participate in or we can do as a career choice, engineering there's plenty of engineering, there is a lot of them on the technology side, especially cybersecurity, the IT, computer world, how to, software world, hardware.",What STEM positions are accessible in the military?,What kind of positions related to STEM do you have in the military?,Does military has a lot of STEM involving positions?,,,,,,,,,,,,,,,,,,,,,,