Topics,Helpers,Mentor,Question,text,P1,P2,P3,P4,P5,P6,P7,P8,P9,P10,P11,P12,P13,P14,P15,P16,P17,P18,P19,P20,P21,P22,P23,P24,P25JobSpecific,Navy,carlosrios,How satisfied have you been with your bosses in your career?,"my satisfaction with the leadership in my organization it depended on different issues. There's a lot of concern leadership which is important to us. Do we always have to agree with their decisions? I have an area of a circle of concern in a circle of influence of those that I have influence in that circle of influence I'm able to change some of the decisions in our command. And then the area of concern then I expect my leadership to look at a their ability to influence those areas that I'm concerned about how they always are they perfect? No. But it takes communication, I communicate to them that I'm not happy and they'll communicate to me their ability to be able to rectify that",Is you leadership competent?,Are officers helpful or are they pests?,Do people senior to you screw with you all the time?,Do you like your boss?,Is your boss scary?,,,,,,,,,,,,,,,,,,,,"JobSpecific, STEM",Navy,carlosrios,Describe the technological environment in which you've worked?,"The technological environment that I work in, I work with computers, I work with servers, we are able to provide our customer databases so they can do their job.They can they can have the ability to do their job. I also work with aircrafts, I'm able to provide them the latest technology to do some type of reconnaissance and they had to do that in reference to the drones that I currently support.",What is the technology around you every day?,Do you work with a lot of technical equipment?,Do you work with fancy gear or just regular tools?,Do you work in a lab or on-site?,,,,,,,,,,,,,,,,,,,,,JobSpecific,Navy,carlosrios,What organizations were most helpful to you in your career?,"The organizations that have been most helpful throughout my career, I have never been one to shy to ask for help. Normally, it's always knowing the right people or the right place to ask to get some type of support the organization that I've always seen to the assist me in my career of course the military bases any of the military's. I've been able to communicate with the navy, the army, the airforce and the marines for support. And of course those organizations outside that military such as any education system I have no doubt I can call a college right now and ask for help in reference to education and I would get assistance",What organizations are important to your work?,Do you have a professional society?,Should I join any professional groups?,,,,,,,,,,,,,,,,,,,,,,"JobSpecific, Risk",Navy,carlosrios,What kind of risks do you need to take in this field?,The risks that you should take in this field is take a chance to go out there and you have a customer who has a need come up with something new you don't have to constantly use the same way they did before on that sometime tends tends to be a constraint if they did it this way we should always do it this way so we bring in new folks all the time and some of them are younger employees they think outside the box and that's very important,Is this dangerous?,Do you sometimes have to take chances?,Has this job ever made you feel insecure?,,,,,,,,,,,,,,,,,,,,,,"JobSpecific, Advice",Navy,carlosrios,Should I go to college before or after serving?,"I will always say go to college first before you join the military give yourself an opportunity to educate yourself and then apply what you learn maybe inside the military, maybe so in another field. If I was gonna do it all over again, my circumstances required me to go in before I got a college degree my children they will go to college first if they choose to join the military",College first or later?,Will the Navy let me go to college while on active duty?,Do college grads do better in this kind of work?,,,,,,,,,,,,,,,,,,,,,,"Impact, JobSpecific","Navy, Positive",carlosrios,How can your work change the world?,I currently serve our customer who are the marines or the marine corps and me providing them a product or a service allows them to go out to the world and and win battles and that's what the marine corps do,Is your work important to all of us?,Will you work help or hurt us?,Will the future be better because of your work?,,,,,,,,,,,,,,,,,,,,,,"Miscellaneous, Background",,carlosrios,What’s your favorite book of all time? Why?,My favorite book of all time has been The call of the wild by Jack London. I must've done nine report cards that's the every time I every opportunity I had to do a report card doing the other early years of my education he would always be called the wild and I think that led me to look for a different life of where I was growing up in in the environment I grew up in and maybe that's why I joined the marine corps because I want to see the world,what have you read that changed you?,have you read anything that made a difference in your life?,what's your favorite read?,Do you have a favorite book?,Is there a book that changed your life?,Is there a book that you love?,Your favorite book?,,,,,,,,,,,,,,,,,,"Miscellaneous, Background",,carlosrios,What’s your favorite movie of all time? Why?,"My favorite movie of all times, well that's a difficult because I like Star Wars and the technology I've always wanted at at a used to grow up a lot of watching all the Star Wars in just imagine myself and in a different place again always relates back to act I grew up in and the technology. The first computer I was ever given was a Sinclair, a laptop and I wish I put as much effort back then I can't really tell fifteen sixteen years old when I got it how well would have been at today if I really applied what I was learning on this small old laptop. Who would know what I'll be doing today but Star Wars has always been one of my favorite movies",is there a movie you really like?,What is one movie that you love?,Do you have a favorite movie?,What movie do you love?,Your favorite movie?,,,,,,,,,,,,,,,,,,,,"Miscellaneous, Background",,carlosrios,"If you could meet anyone in the world today, who would it be and why? What would you say to that person?","So many and it depends on the frame of mind Gandhi, Mother Teresa, people who give up from themselves to others. I think one of things I do now I love STEM,  I like waking up in the morning and knowing that may have an opportunity to provide some mentorship to the, our younger generation. But it's always about giving myself to someone else. What would I say to them? I would I think anybody else will say thank you not even question why because I feel that I think that's something we all should do",one famous person you'd like to talk to about something of interest to you?,Who is one person you would like to meet and what would you ask them?,who would you like to meet and talk to?,Who would you love to meet and ask questions?,,,,,,,,,,,,,,,,,,,,,Motivation,Positive,carlosrios,What kind of personal satisfaction do you get from your job?,"The personal satisfaction I get from my job is fulfilment and it gives me purpose. I wake up in the morning and I get to work and the camaraderieship between my fellow, my co-workers and the customer at the other end who need something. And again It's always about what can I do for someone else, it's always a plus and I get paid to do something I love to do which is a cherry on top. But at the end of the day, it's all about having purpose.",does your job make you feel good about yourself?,how does your work improve your own self-image?,what part of you feels good after a day's work?,Does your work satisfy you?,Do you feel satisfied doing your job?,Does your job make you satisfied?,,,,,,,,,,,,,,,,,,,"Miltary, Fit",,carlosrios,"What qualifications, experience, do you look for when interviewing new people in this field?","What kind of qualifications do I look for or skills when I interview other people for these positions, I tend to of course is your education. You don't need to necessarily a degree but it does help. The more education I think the better you are able to articulate yourself especially with a customer. There's a lot of certification to get lean six, sigma, green belt, black belt or what not and how to improve our processes. The more experience you have I think the more of a partner you're going to be in these positions.",how should I sell myself to get in the Navy?,what do I need to be able to say about myself to work in this field?,What do recruiters look for when choosing new candidates for this field?,What do recruiters look for in potential candidates?,What do I need to do in order to get into this field?,What qualifications and experience do I need for this field?,,,,,,,,,,,,,,,,,,,"Challenges, STEM",Navy,carlosrios,What do you see as the major problems for those working in this field today?,"The major problems I see in people that work in this field today are there inability to be flexible, you have to have drive. You always gotta remember especially in my line of work or logistics field the customer has a purpose, he has a mission and he can't stop because you decide you can't do something. So our ability to be able to be flexible and I drive to meet our customer's demands is very point.",What are the major issues of this field?,What do you see as the significant issues for those working in this field today?,What do you see as the huge issues for those working in this field today?,What do you see as the immense issues for those working in this field today?,Do you think working for this field entails some major issues?,,,,,,,,,,,,,,,,,,,,"Miscellaneous, Motivation",,carlosrios,What person do you most admire and why?,"A person that I most admire in my life is my wife.  She was a wife of a military service member. I would leave for a year and come home for two or three months, just to leave again for six months and this whole time she was able to to raise and maintain a household while I was gone. to Iraq. to Afghanistan so who do I admire the most in my life? my wife.",who is really cool to you?,what person stands out to you?,who is the best role model?,Whom do you admire?,Which person do you admire and why?,Who is a role model for you?,Who is your role model?,,,,,,,,,,,,,,,,,,Background,,carlosrios,Where were you born?,I was born in New Haven Connecticut.,Where are you from?,in what city were you born?,what's your home state?,Were you born in Los Angeles?,,,,,,,,,,,,,,,,,,,,,Miscellaneous,,carlosrios,Tell me a funny story?,"I'll tell you a funny story. When I was growing up I remember seeing the movie ""The Warriors"" and now after that movie, myself and two of my good friends are childhood friends: George and Booboo.  We created our own little gang called ""The Orphans"" after that movie.",make me laugh,what tickles you,tell me something funny.,Narrate a funny story.,have you ever been in australia?,tell me a story.,do you know any funny stories?,,,,,,,,,,,,,,,,,,"JobSpecific, STEM",Navy,carlosrios,What did you do predictions on in the Marines? ,"So I was an analyst for the Marine Corps which required me to do maintenance predictions so Marine Corps send me to school to learn how to predict failures on aircraft, so same thing as if a part was gonna fail, how many flight hours or how many flights would it take before it failed, and me being able to predict how many of those parts I had to have readily accessible so they can be immediately get the aircraft back in a flying status.",What were you trying to predict in the Marines?,What did you do as an analyst?,What were your roles as an analyst?,What did you work on as an analyst?,,,,,,,,,,,,,,,,,,,,,"JobSpecific, Decisions",Navy,carlosrios,Why did you do artillery?,"When I first joined the marine corps, you had to take an ASVAB, which is a test to determine what career field you might fit in due to your level of education.  It's funny to me that I went open contract.  The reason I went open contract means that they didn't guarantee me a field because my scores weren't high enough, in fact I took the same test twice and got the exact same score which meant I knew what I didn't know and I've got %HESITATION selected to join artillery, which is wasn't one of the fields that needed a lot of education, but I was very fortunate because if probably one of the best things I did in my life.",For what reason did you do big guns?,What pulled you towards artillery?,Why did you choose artillery?,What made you do artillery?,,,,,,,,,,,,,,,,,,,,,"JobSpecific, Background",Navy,carlosrios,How long did you do artillery? What did you do there?,"I was in artillery, or what we call artillery men, for four years.  In those four years I had the opportunity of course to do a lot of training and I went on a lot of deployments. or I went away to other countries to train, but most important I was I had the opportunity I was sent to participate in the Gulf War.  I did that was four year of artillery, unfortunately I was told that I had after the four years I had to pick another job which I picked aviation, and I did became an analyst for the marine corps.",What duration of your service did you spend in artillery?,What was your role in artillery?,How long did you spend in artilerry?,What was your job function in artillery,What did you do in artillery?,,,,,,,,,,,,,,,,,,,,JobSpecific,Navy,carlosrios,Who are your customers?,My customers currently are the marine corps.,Whom do you supply logistics?,What are the kinds of organizations you supply logistics to?,Which branches of military buy logistics from you?,,,,,,,,,,,,,,,,,,,,,,JobSpecific,Navy,carlosrios,What are your main products?,"My main product as a logistics specialist are laptops, servers and currently drones.",Can you list your main products?,What all do you sell?,What are things you mainly sell to the military?,What kind of logistics do you supply?,,,,,,,,,,,,,,,,,,,,,"JobSpecific, STEM",Navy,carlosrios,How do you work with engineers?,"When I work with engineers in my field, we work on an acquisition process to provide our customer a product, such as: I find them a computer, now I have to engineer a case for that computer.",What is your way of working with engineers?,How do you manage working with engineers?,What do engineers do for you?,Do you work with engineers?,,,,,,,,,,,,,,,,,,,,,"JobSpecific, Financial",Navy,carlosrios,How much financial work do you need to do?,I currently do some financial work with my customer because I've had the opportunity not only to do logistics but also program management.,How much of finance do you need to worry about?,How much of finance work are you responsible for?,Can you tell me how much of financial work you do?,,,,,,,,,,,,,,,,,,,,,,JobSpecific,Navy,carlosrios,What do contracting people do?,The contract people currently assist me in developing new contracts to either buy material or provide services.,What is the job of contracting people?,What role does contracting people play in your job?,How can you define the function of contracting people?,,,,,,,,,,,,,,,,,,,,,,Jargon,Navy,carlosrios,What is six sigma?  What are green belt black belt?,"Six sigma and the levels of yellow, green, and black belt are processes using production and during my early years.  However I was able to go to a community college that the marine corps send me to in order for me to help the organization improve its production process.",What do you mean by six sigma?,What do you mean by green belt and black belts?,Can you define six sigma?,Can you tell more about green and black belt?,What is the meaning of six sigma?,,,,,,,,,,,,,,,,,,,,"Background, Family",Navy,carlosrios,Does your wife work?,"My wife was a homemaker for the initial probably twenty years, as much as I was when I initially was in the marine corps.   She had different jobs during that time.  Now she's a office assistant at the local hospital.",Is your wife a professional?,What job does your wife do?,Is your wife employed?,Is your wife a homemaker?,,,,,,,,,,,,,,,,,,,,,"JobSpecific, STEM",Navy,carlosrios,How do you know how long it will take a part to fail?,"Normally using predictions and previous failures I'm able to determine when that part should fail and does it always fail at that time? No, but it gives me a general idea and allows me to prepare with more parts on the site.",How do you predict the time it takes for a part to fail?,How do you estimate the when will a part fail?,Can you find how long will a part take to fail?,How do you find out when a part will fail?,,,,,,,,,,,,,,,,,,,,,"Combat, Military",Navy,carlosrios,Did you ever go into combat?,As a marine I had the opportunity or I was sent to the Gulf War in 1991 and then I also supported our troops when we were in Afghanistan.,Have you ever fought in combat?,Did you participate in a combat?,Have you ever been on field in a war?,Have you ever been deployed for combat?,,,,,,,,,,,,,,,,,,,,,"Challenges, JobSpecific",Navy,carlosrios,What is the most challening part about your job?,"The most challenging part of my job is to try to find new ways to provide my customer a product or a service. Examples are: I can take something, I can buy something, put in a box and ship it to my customer. How do I ship it?  Do I send it via Fedex? Do I use the United States Postal Service or our own internal modes of transportation.  Do they put in a truck and just drive across?  It all depends on how quick my customer wants it.",what do you do that is difficult?,Is your job tough?,what's the worst thing about your job?,What do you not like to do?,What do you hate doing?,Was there ever a time you hated your job?,What did you hate about being in the Navy?,what is the biggest challenge you've had in the Navy?,what are the challenges of being a sailor?,Was there ever a time when you hated your job/,,,,,,,,,,,,,,,"Challenges, Military",Navy,carlosrios,What is the biggest barrier to entry in this field?,"The biggest barrier to my field is not understanding what logistics does.  We're a broad field, we do transportation, shipping, handling, procurement and the individuals who come into our field should have a general idea where do they want to start their careers in.",what would keep me out of this line of work?,is there something that keep people from being able to do this?,what is the hardest thing to master before you can get in this field?,What do you have to discipline new cadets most on?,what is hardest for new recruits to learn?,what is difficult to adjust to when joining the Navy?,,,,,,,,,,,,,,,,,,,"Motivation, Background, Military",Navy,carlosrios,How did you become interested in this type of work?,"I became interested in the logistics field because I've always felt that i did some type of logistics throughout my career.  In the marine corps, I provided parts.   In the marine corps, I lead marines to provide a service for someone else, and when I retired from the marine corps, I had the opportunity to continue to support the marines that I worked with the same level of quality as a logistician for the current organization I work for.",What got you into this job?,how did you come to want to do this?,Did you always want to be in this career field?,How did you you become interested in the Navy?,,,,,,,,,,,,,,,,,,,,,"Decisions, Background, Motivation",Navy,carlosrios,Why did you choose this career?,I chose this career because of the exciting opportunities to continue to support my customer who I was very familiar with.,tell me why you are in the navy.,did you choose the Navy or was it forced on you?,why are in your current job?,why did you take this career path?,How did you choose the Navy?,what went into choosing your career in the Navy?,why did you join the navy?,was the Navy your first choice?,How did you decide to join the navy?,Why did you choose the military?,Why did you choose the Navy?,How did you decide you wanted to go into the navy?,What is your job today?,why did you choose your current job,,,,,,,,,,,"Decisions, Military",Navy,carlosrios,"If you could do it all over, would you choose this career again?","If I had the opportunity to do this all over again and pick another field, I think I enjoy this that I don't have no regrets that I had the opportunity to do this.  I do tell other folks that if I could start again when I was going through school, in  elementary, middle school, high school, what not, I would've gone to college and who knows what I would've been doing today.",if you were starting over would you make the same choices about your career?,do you regret choosing this career path?,do you any regrets about choosing this profession?,did you miss out on anything by joining the Navy?,what do you give up for the Navy?,what negative consequences have come from your work?,do you regret anything from going to the navy?,,,,,,,,,,,,,,,,,,"Background, Childhood",,carlosrios,"When you were a kid, what did you want to be when you grew up?",I think I've always wanted to be a marine.,did you dream of doing a job like this?,did you have dreams of being something else?,do you remember what you used to think you wanted to do as an adult?,do you like the arts?,are you artistic?,Do you have other passions besides STEM?,Why don't you just do music as a hobby then?,why didn't you pursue music?,do you like art?,,,,,,,,,,,,,,,,"Background, Childhood",,carlosrios,What sports did you play in high school?,"I didn't play too many sports, I was very small, I think I weighed a hundred thirty pounds. I tried the football team in high school but it wasn't, it didn't work out the way I thought it was.",were you an athlete in high school?,were you ever on sports teams before coming in the Navy?,what sports did you like to play?,are you athletic?,what did you do in high school?,did you do any activities or extraurriculars in high school?,,,,,,,,,,,,,,,,,,,Miscellaneous,,carlosrios,What is your favorite color?,My favorite color is blue.,do you have a favorite color?,do you have any color preferences?,"other than Navy blue, what colors do you like?",,,,,,,,,,,,,,,,,,,,,,"Background, Family",,carlosrios,Are you married?,I am married.,have you got a spouse?,are you single?,do you have a wife?,are you in love?,do you have a girlfriend?,are you in a relationship?,do you date?,do you have a significant other?,how many times have you been married?,Do you have a significant other?,Do you have a girlfriend?,Do you have a boyfriend?,Do you date?,"Being in the navy, is it difficult for you to have a relationship?",Do you have any kids?,do you have a lover,,,,,,,,,"Background, Family",,carlosrios,Do you have siblings?,I have two sisters that live in Philadelphia. I have two step sisters that live in Florida and one brother.,do you have any brothers or sisters?,how many kids in your family growing up?,are you an only child?,how is your relationship with your brother or sister?,,,,,,,,,,,,,,,,,,,,,Miscellaneous,,carlosrios,Do you have any pets?,"I used to have a turtle, but the upkeep became too much for us so I retired him to a pond.",did you ever own an animal?,were you responsible for a pet?,did your parents allow you to have a pet?,have you had a pet?,do you like animals?,do you have a cat?,do you have a dog?,do you like pets?,Do you like cats?,,,,,,,,,,,,,,,,Miscellaneous,,carlosrios,What is your favorite food?,"Spanish food, I love rice and beans.",what do you like to eat?,what is your ideal meal?,do you have a favorite dish ?,what is you preferred cuisine?,,,,,,,,,,,,,,,,,,,,,Miscellaneous,,carlosrios,What is your least favorite food?,Spinach.,is there anything you hate to eat?,what food makes you gag?,what food do you hate?,,,,,,,,,,,,,,,,,,,,,,"JobSpecific, Lifestyle",Navy,carlosrios,What is the food like in the military?,"The food in the military tends to be very bland, they make food for a lot of people at the same time.",how is Navy chow?,are the mess halls good places to eat?,can you eat well in the military?,is there healthy food in the Navy?,how is the food?,how's the food?,what is the food like?,is Navy food good?,,,,,,,,,,,,,,,,,Combat,Navy,carlosrios,Do you shoot guns?,"I have shot all types of guns.  I have shot artillery pieces, a 155 millimeter round, all the way to a 7.56 from an M16.",how often do you get to shoot guns?,do you fire rifles in the Navy?,does everyone use guns?,,,,,,,,,,,,,,,,,,,,,,Combat,Navy,carlosrios,Did you ever have to kill anyone?,I was always taught by my dad that there's two things you don't talk about: The people you kill or the relationships you have.,Have you ever taken another life?,Did shoot someone ?,Have you ever killed?,Did you neutralize a target?,,,,,,,,,,,,,,,,,,,,,"Recognition, Military, Jargon",Navy,carlosrios,What are the ribbons/awards that you've gotten?,"So I've had variety of ribbons and awards throughout my career.  I've had of course combat action ribbons, serving ribbons that identify the number of times I've been deployed or overseas, the number times I've been in a combat environment and then awards for excellence doing those times.",which medals did you earn?,what recognition have you gotten?,what did you do to earn your decorations?,have you gotten any awards for your service?,what are your military acheivements?,,,,,,,,,,,,,,,,,,,,"Military, Culture, Background",Navy,carlosrios,Do you have any tattoos?,I only have one tattoo which is the United States Marine Corps tattoo.,do you like to have tattoos?,did you ever get tattooed ?,are tattoos common in the Navy?,what tattoos do you have?,show me your tattoos.,,,,,,,,,,,,,,,,,,,,