Question,P1,P2,P3,P4,P5,P6,P7,P8,P9,P10,P11,P12,P13,P14,P15,P16,P17,P18,P19,P20,P21,P22,P23,P24,P25,P26
How much do you understand the overall goals of what you are doing?,Do you understand the goals of your work?,Are the goals of your work clear?,Does your work further an overall goal?,What is the overall goal of your work?,How does your work support the mission?,How does your work support the Navy?,,,,,,,,,,,,,,,,,,,,
How much of your private time is spent doing your job?,Does your work take away your personal life?,Does your work affect your private time?,Do you take work home with you in the Navy?,Is your free time dedicated to the Navy?,How much free time do you use for your Navy work?,Is being in the Navy a 24/7 job?,Are you always on call in the Navy?,How often did you get to go home?,,,,,,,,,,,,,,,,,,
"Off of active duty, do you still take work home with you?","In civilian life, do you take work home with you?",Does a computer scientist take work home with him?,Do you have to work at home now that you are out of the Navy?,What are your work hours like being in the Navy Reserve?,Do you work less now that you are in the Navy Reserve?,Is being in the Navy Reserve like a nine to five job?,,,,,,,,,,,,,,,,,,,,
How much turnover is there in the Navy?,Does the Navy have a high turnover rate?,Do people usually leave the Navy after their term has ended?,Do people often leave the Navy?,Do people like to stay in the Navy?,Do people extend their stay in the Navy?,How many people extend their Navy contracts?,,,,,,,,,,,,,,,,,,,,
How stable is employment in the Navy?,Is Navy employment stable?,Does the Navy offer job security?,Can you get fired from the Navy?,Will I have to worry about job security in the Navy?,Will I always have a job if I'm in the Navy?,Can I get fired from the Navy?,,,,,,,,,,,,,,,,,,,,
What opportunities do you have to alter your own work schedule?,Can you work your own hours in the Navy?,Can you choose when to work in the Navy?,Can you design your own work schedule in the Navy?,"Can you decide what to do, when to do in the Navy?",Do I get to choose how to do my job in the Navy?,Do I get to choose my own tasks?,,,,,,,,,,,,,,,,,,,,
How many Navy members have high stress symptoms?,Is a Navy career stressful?,Are Navy members stressed?,How stressful is the job?,Do you suffer from stress in the Navy?,How many Navy people suffer from stress?,,,,,,,,,,,,,,,,,,,,,
What happens if I don't like this line of work?,What if I don't like it?,What if I don't want to stay in the Navy after I get in?,What happens if I hate my Navy position?,Am I allowed to leave the Navy?,How do I get out?,How can I quit the Navy?,What if I don't want to stay in the Navy after I get in?,,,,,,,,,,,,,,,,,,,
What opportunities do you have to change career field?,Can you change positions in the Navy?,Will I have the choice to pivot careers?,Is my position set in stone in the Navy?,Can I switch positions in the Navy?,Can I switch careers?,,,,,,,,,,,,,,,,,,,,,
What experiences do you have with nukes?,Have you dropped a nuke?,What have you learned about nuclear bombs?,Do you know how nuclear bombs work?,What do you know about nuclear technology?,What did you learn about nukes?,,,,,,,,,,,,,,,,,,,,,
What is the role of nuclear technology in the Navy?,How is nuclear technology used in the Navy?,How is nuclear technology important to the Navy?,What makes nuclear technology important?,Why do you need nuclear technology in the Navy?,Did you work with nukes?,Have you seen a nuclear bomb?,,,,,,,,,,,,,,,,,,,,
What does your startup do?,What is your startup?,What work does your startup do?,Are you in a startup?,What are you building in your startup?,how did you get into your startup?,how did you get hired?,does your startup make games?,what kind of games does your startup make?,Tell me more about the game you created,tell me about the game you are making?,are you working on a game?,What kind of games do you make?,,,,,,,,,,,,,,
Do you speak any other languages?,What languages do you speak?,Do you know a lot of languages?,How many languages do you speak?,Do you speak languages other than English?,,,,,,,,,,,,,,,,,,,,,,
Describe a particular technical issue you've had to solve on the job.,What is an example of a technical solution you've found?,Have you solved technical problems?,What technical issues do you solve?,Can you give an example of a technical problem you solved?,Do you have to be a technical expert?,,,,,,,,,,,,,,,,,,,,,
How much of your time is spent with people versus with technology?,Do you spend all of your time with machines?,Do you stare at a screen all day?,Do you get to talk to people?,Is it boring working on only technology?,,,,,,,,,,,,,,,,,,,,,,
What's up?,What is up?,What is going on?,What are you up to?,What are you doing?,how's it hanging?,,,,,,,,,,,,,,,,,,,,,
How is the weather?,What is the weather like?,Is it really bad outside?,Is it nice there?,What's the weather?,Is it warm outside?,Is it raining?,What is the weather like right now?,,,,,,,,,,,,,,,,,,,
How are you?,How are you doing?,Are you well?,How's it going?,How was your day?,are you happy?,how do you do?,,,,,,,,,,,,,,,,,,,,
Where are you?,Where are you now?,Where do you currently live?,Which city are you in right now?,Are you in the US now?,,,,,,,,,,,,,,,,,,,,,,
What are your hobbies?,What do you do for fun?,What are you interested in?,What do you do in your spare time?,What do you like to do?,do you play video games?,do you have any hobbies?,,,,,,,,,,,,,,,,,,,,
How did you get into archery?,Why archery?,When did you learn archery?,What made you do archery?,,,,,,,,,,,,,,,,,,,,,,,
What is a chief?,What does Chief mean?,Who is a Chief?,Is Chief Petty Officer and Chief the same?,,,,,,,,,,,,,,,,,,,,,,,
"What does ""in port"" mean?","What is ""in port""?",What does it mean to be in port?,When are you in port?,What is a port call?,What does port call mean?,,,,,,,,,,,,,,,,,,,,,
What is a rate?,What does rate mean?,What does the Navy call specialities?,What's the way to tell what a sailor does?,,,,,,,,,,,,,,,,,,,,,,,
What experience do you have with nuclear bombs?,Do all people like you work on A-Bombs?,Do you often work on A-Bombs?,Are you afraid of atom bombs?,Did you work on nuclear bombs?,Have you seen nuclear bombs?,Does your position involve creating nuclear bombs?,Did you build nuclear bombs?,Did you build nukes?,,,,,,,,,,,,,,,,,,
How often have you been deployed?,When do you get deployed?,How many deployments do you go on?,Are you always deployed?,How many times do you go on deployment?,how long are deployments?,how long do deployments last?,how long are you on a ship for at a time?,have you been on a ship?,,,,,,,,,,,,,,,,,,
What was 9-11 like for you?,Did 9-11 make an impact on you?,How did 9-11 affect you?,How was 9-11 for you?,Were you serving during 9-11?,Did you fight in a war after 9-11?,Do you remember 9-11?,Where were you when 9-11 happened?,Did you know anyone affected by 9/11?,Do you remember 9-11 as it affected your career?,Was your career affected by 9-11?,Where were you on 911?,,,,,,,,,,,,,,,
Why do you love your job?,What makes you love your job?,Why do you like what you do?,Why do you enjoy what you do?,What is good about what you do?,What do you love about the Navy?,what do you like about the Navy?,do you like what you do?,,,,,,,,,,,,,,,,,,,
What gets romanticized about your career field that really isn't that great?,What is exaggerated about the Navy?,What do people think is good about your job that really sucks?,How is your job worse than what people think?,,,,,,,,,,,,,,,,,,,,,,,
What makes the Navy different than other branches of the military?,"How does the Navy differ from the Army, Air Force and Marines?",Are the other services like the Navy?,Do the other services compare with the Navy?,How is the Navy different from other services?,what's the difference between the navy and the army?,what is the difference between the navy and the army?,,,,,,,,,,,,,,,,,,,,
What are some of the common misconceptions about your field?,How are people fooled about what you do for a living?,Do people get the wrong idea about what you do?,What are the myths about what you do?,Do the movies and TV portray your job well?,Is you work as stressful as it is shown on TV?,can you swim?,Do you know how to swim?,,,,,,,,,,,,,,,,,,,
What are some of the common misconceptions about working in nuclear technologies?,Is working on nuclear power well understood by others?,What do people get wrong about nuclear technologies?,What do most people get wrong about the nuclear field?,What don't people know about the nuclear field?,What do people think of that is incorrect about the nuclear field?,,,,,,,,,,,,,,,,,,,,,
What do you do in the Navy that is different from what you expected?,Were you disappointed by your preconceived notions about the Navy?,Did your recruiter tell you something that was not true?,Did you know you'd be doing this kind of work?,How is your work different from what you expected?,Did the Navy job meet your expectations?,Did you ever go to Iran or Iraq?,What was unexpected about the military?,You never went to Iran or Iraq?,,,,,,,,,,,,,,,,,,
How did your work day change over your career?,Compare you day now to when you started?,Is you work day different now?,Did you like the way your work day used to be?,How has your work day changed over a period of time?,Has your work day changed over the years?,,,,,,,,,,,,,,,,,,,,,
How has your view of this line of work changed over time?,"Have you changed your opinion about this line of work and if so, how?",Has your opinion of your job altered?,What about your attitude change concerning your profession?,Has your view of this work changed and how?,,,,,,,,,,,,,,,,,,,,,,
"Where did you have to move in your career, and how did that change things each time?",Tell me about you being transferred?,Is change of station tough?,Do orders to a new command disrupt your life?,,,,,,,,,,,,,,,,,,,,,,,
What do you find unique about your career field?,Is your job different from others?,Do other jobs seem like yours?,Why is your job special?,,,,,,,,,,,,,,,,,,,,,,,
Are great practitioners in this field made or born?,Can I do this work?,Who can't do their job?,Can one be trained to do this well?,,,,,,,,,,,,,,,,,,,,,,,
What priorities would you recommend for a person entering this field?,What should I do first if I want to do this?,What most important for me to do?,Are there things that would keep me from doing this?,,,,,,,,,,,,,,,,,,,,,,,
How fair are the expectations of you as an employee?,Are the orders that you get fair?,Are you ever asked to do more than you are able to do?,Who decides how much work you should do?,Do you think you are overworked?,Are you overworked?,How fair is working for the military?,,,,,,,,,,,,,,,,,,,,
How accepting of failure is this work environment when a good and honest effort was made?,"If you screw up, but worked hard, do you get another chance?","Is failure, even if it is not your fault, held against you?",Do you get blamed if something does not work?,How severe is failure at work?,,,,,,,,,,,,,,,,,,,,,,
What range of tasks and opportunities does this field present to allow me to grow?,Can I move up?,Does everybody have a chance to get promoted?,Is there always something new to learn and master?,,,,,,,,,,,,,,,,,,,,,,,
How satisfied have you been with your bosses in your career?,Is you leadership competent?,Are officers helpful or are they pests?,Do people senior to you screw with you all the time?,Do you like your boss?,Is your boss scary?,,,,,,,,,,,,,,,,,,,,,
Describe the technological environment in which you've worked.,What is the technology around you every day?,Do you work with a lot of technical equipment?,Do you work with fancy gear or just regular tools?,Do you work in a lab or on-site?,,,,,,,,,,,,,,,,,,,,,,
What is your opinion on nuclear energy and its future?,Do you think this field will be around for years or go away?,Are you happy working in this field?,Don't you think this work is dangerous to everyone?,,,,,,,,,,,,,,,,,,,,,,,
What organizations were most helpful to you in your career?,What organizations are important to your work?,Do you have a professional society?,Should I join any professional groups?,,,,,,,,,,,,,,,,,,,,,,,
What is MWR?,"What does morale, welfare and recreation do?",Who takes care of your having a good off-duty life?,Is MWR a Navy organization?,,,,,,,,,,,,,,,,,,,,,,,
What is USO?,Is USO the group that puts on shows for GIs and Sailors?,What does USO stand for?,Is USO part of your life?,,,,,,,,,,,,,,,,,,,,,,,
What kind of risks do you need to take in this field?,Is this dangerous?,Do you sometimes have to take chances?,Has this job ever made you feel insecure?,,,,,,,,,,,,,,,,,,,,,,,
Should I go to college before or after serving?,College first or later?,Will the Navy let me go to college while on active duty?,Do college grads do better in this kind of work?,,,,,,,,,,,,,,,,,,,,,,,
How can your work change the world?,Is your work important to all of us?,Will you work help or hurt us?,Will the future be better because of your work?,,,,,,,,,,,,,,,,,,,,,,,
What's your favorite book of all time? Why?,what have you read that changed you?,have you read anything that made a difference in your life?,what's your favorite read?,Do you have a favorite book?,Is there a book that changed your life?,Is there a book that you love?,Your favorite book?,,,,,,,,,,,,,,,,,,,
What's your favorite movie of all time? Why?,is there a movie you really like?,What is one movie that you love?,Do you have a favorite movie?,What movie do you love?,Your favorite movie?,,,,,,,,,,,,,,,,,,,,,
"If you could meet anyone in the world today, who would it be and why? What would you say to that person?",one famous person you'd like to talk to about something of interest to you?,Who is one person you would like to meet and what would you ask them?,who would you like to meet and talk to?,Who would you love to meet and ask questions?,,,,,,,,,,,,,,,,,,,,,,
What kind of personal satisfaction do you get from your job?,does your job make you feel good about yourself?,how does your work improve your own self-image?,what part of you feels good after a day's work?,Does your work satisfy you?,Do you feel satisfied doing your job?,Does your job make you satisfied?,,,,,,,,,,,,,,,,,,,,
What qualifications and experience do recruiters look for when choosing new people for this field?,how should I sell myself to get in the Navy?,what do I need to be able to say about myself to work in this field?,What do recruiters look for when choosing new candidates for this field?,What do recruiters look for in potential candidates?,What do I need to do in order to get into this field?,What qualifications and experience do I need for this field?,,,,,,,,,,,,,,,,,,,,
What do you see as the major problems for those working in this field today?,what are the hot button issues in this line of work?,what worries most people about this work area?,what are some issues for people working in this field?,What are some problems that people who work in this field face?,What are some problems that you face?,what is the future of the Navy?,tell me about the future of the military.,,,,,,,,,,,,,,,,,,,
What person do you most admire and why?,who is really cool to you?,what person stands out to you?,who is the best role model?,Whom do you admire?,Which person do you admire and why?,Who is a role model for you?,Who is your role model?,,,,,,,,,,,,,,,,,,,
Tell me a funny story.,make me laugh,what tickles you,tell me something funny.,Narrate a funny story.,have you ever been in australia?,tell me a story.,do you know any funny stories?,,,,,,,,,,,,,,,,,,,
Where were you born?,Where are you from?,in what city were you born?,what's your home state?,Were you born in Los Angeles?,,,,,,,,,,,,,,,,,,,,,,
What is Japan like?,describe where you are now,talk about your current surroundings,let me know what you think about where you live,how is Japan?,How is Japan different from America?,Tell me about the place where you currently live. ,Tell me about Japan.,Describe Japan.,Do you like Japan?,Can you tell me about your life in Japan?,do you want to live in Japan?,could you see yourself settling down or moving to Japan?,what is your favorite country,,,,,,,,,,,,,
What do you do in computer science/programming?,talk about working on computers.,what kind of computer work do you do?,are you a hardware of a software guy?,What exactly do you do in computer science?,Do you write code?,Do you build computers?,What is it that you do with computers?,What is the difference between software and hardware engineering?,what is the difference between computer science and software engineering?,what's the difference between computer science and software engineering?,,,,,,,,,,,,,,,,
What is your strategy for overcoming your hardships?,how do you handle tough situations?,in what way do you get over hurdles?,how do you meet challenges?,How do you face hurdles?,How do you deal with hardships?,What is your game plan for dealing with hardships and challenges?,How do you overcome challenges?,,,,,,,,,,,,,,,,,,,
What advice do you have for someone who is growing up surrounded by drugs and crime when sometimes it seems like it's too hard to get through school?,how can a person come out of a tough neighborhood and still do well?,do you believe some people are just lost and can never have a good life?,does a bad childhood ruin a person or strengthen them?,What advice do you have for someone who grew up in tough surroundings?,How does a tough childhood affect someone and how can they come out of it?,,,,,,,,,,,,,,,,,,,,,
Were you ever bullied in high school? What did you do?,how do you handle tough guys?,is there a way to stand up to mean people?,Did people bully you in high school?,Have you been bullied in high school?,What was high school like for you?,,,,,,,,,,,,,,,,,,,,,
What advice do you have for people who are being bullied in high school?,Can you give some advice to handle bullies?,can people develop courage and handle bullies?,how does a person learn to fight back against bullies?,How do you handle bullies?,Can you tell me how to handle bullies?,,,,,,,,,,,,,,,,,,,,,
Do you have a family?,What's your family like?,Do you have family?,Do you have kids?,,,,,,,,,,,,,,,,,,,,,,,
What advice do you have for spouses who don't understand the career demands of the Navy?,can families get used to or learn to love the Navy life?,do some spouses never learn to get along in the Navy?,is there a way to talk someone into liking the Navy way of life?,How do Navy people convince their spouses about the demands of the Navy?,How can you make spouses understand about life in the Navy?,Is there a way to handle spouses who don't understand the demands of the Navy?,How to handle spouses who can't understand the demands of the Navy?,,,,,,,,,,,,,,,,,,,
Did you like wearing the same uniform every day? Why or why not?,how is wearing the same uniform everyday?,Do you like dressing the same way every day?,Do you hate your uniform?,What do you feel about wearing the same uniform daily?,Did you hate wearing the same uniform every day?,What uniform are you wearing?,,,,,,,,,,,,,,,,,,,,
What is a regulator?,do electrician work with regulators?,what do regulators do?,how does a regulator work?,Explain the working of a regulator.,Tell me what a regulator is.,,,,,,,,,,,,,,,,,,,,,
Tell me about Naval Postgraduate School.,is NPS Naval Postgraduate School?,who goes to Naval Postgraduate School?,what's it like at NPS?,What is the naval postgraduate school?,,,,,,,,,,,,,,,,,,,,,,
Where is the Naval Postgraduate School?,Where is the naval postgraduate school located?,is NPS in California?,is NPS close to San Francisco?,Where is the NPS?,Which city is the NPS in?,,,,,,,,,,,,,,,,,,,,,
What are the most important things on a resume?,What should be included in a resume?,What are some of the things that must be on a resume?,What can I not afford to exclude from my resume?,How should my resume look like?,What is needed in a resume?,,,,,,,,,,,,,,,,,,,,,
Where can I find an internship that will give me skills for the engineering field?,Where can I find relevant internships?,Where can I find apprenticeships in engineering?,Where do I look for internships?,Where do I find engineering internships?,Where can I look for internships in engineering?,How do I get an internship?,How do I become an intern?,Are there lots of internships?,,,,,,,,,,,,,,,,,,
What do you advise me to do in picking the right career field for me?,tell me how to make the best job decision?,can you help me pick the right career field for me?,how can I be sure I am doing the right thing?,What advise can you give me that can help me in picking the right career field?,how do I pick the right career field?,When did you switch from nuclear tech to computer science?,,,,,,,,,,,,,,,,,,,,
How do I find what I love to do?,How can I find what I am passionate about?,How to find what I love to do?,What are some indicators that I love something?,How do I find my passion?,Tell me how to find a passion.,I don't know what I want to do.,,,,,,,,,,,,,,,,,,,,
What should I do if I don't know what job I want to do?,I don't know what job I want. How do I solve this?,can you help me if I don't know what to do?,I'm stuck in selecting my career path. Can you help?,What should I do if I don't know which job would suit me best?,,,,,,,,,,,,,,,,,,,,,,
Who are the best people to talk to when making a career choice?,who should I talk to first?,what kind of people are helpful in assessing where I belong?,where should I go for career advice?,Who can advise me in making a career choice?,Who are the best people to consult when making a career choice?,,,,,,,,,,,,,,,,,,,,,
Who first introduced you to the military lifestyle?,How did you first find out about the military?,Who gave you the best advice about the military?,Did you get a glimpse of the military life before you enlisted?,Who gave you valuable advice that helped you?,,,,,,,,,,,,,,,,,,,,,,
What is one piece of advice that you wished you had taken?,what's the best thing anybody told you that you wish you'd listened to?,is there some piece of advice you wished you'd used?,did you ignore something you now know would have been useful?,What is one advice that you ignored?,Is there advice you ignored that would have helped you today?,do you have any regrets?,do you feel like you have missed out on anything?,"You're still pretty young, do you miss the action?",,,,,,,,,,,,,,,,,,
What is one question you wish you had asked earlier?,what did you wish had found out earlier?,What is one question you never asked?,What did you never ask but wish you had?,One question you wish you had asked before?,Is there something you wish you had asked earlier?,,,,,,,,,,,,,,,,,,,,,
What is something you wish you had known before choosing your career?,what should you have known before settling on a job?,was there something vital that you should have found out about your job before you began?,what was missing data in your job search?,Is there something about your career you wish you had known before making a career decision?,Is there something that would have affected your career decision but you never knew it then?,,,,,,,,,,,,,,,,,,,,,
What is the most challenging part about your job?,what do you do that is difficult?,Is your job tough?,what's the worst thing about your job?,What do you not like to do?,What do you hate doing?,Was there ever a time you hated your job?,What did you hate about being in the Navy?,what is the biggest challenge you've had in the Navy?,what are the challenges of being a sailor?,Was there ever a time when you hated your job/,,,,,,,,,,,,,,,,
What is the biggest barrier to entry in this field?,what would keep me out of this line of work?,is there something that keep people from being able to do this?,what is the hardest thing to master before you can get in this field?,What do you have to discipline new cadets most on?,what is hardest for new recruits to learn?,what is difficult to adjust to when joining the Navy?,,,,,,,,,,,,,,,,,,,,
How did you become interested in this type of work?,What got you into this job?,how did you come to want to do this?,Did you always want to be in this career field?,How did you you become interested in the Navy?,,,,,,,,,,,,,,,,,,,,,,
How did you first become interested in computer science?,what brought you into computer science?,did you always love programming computers?,do you remember your first introduction to computers?,how did you get introduced to computer science?,how did you choose your major?,how did you choose computer science?,when did you discover your passion?,How did you find your passion?,why did you go into computer science?,why did you join CS?,why did you study computer science?,Do you have a million dollar idea?,How did you choose your field?,So when did you start finding your passion?,,,,,,,,,,,,
Why did you choose this career?,tell me why you are in the navy.,did you choose the Navy or was it forced on you?,why are in your current job?,why did you take this career path?,How did you choose the Navy?,what went into choosing your career in the Navy?,why did you join the navy?,was the Navy your first choice?,How did you decide to join the navy?,Why did you choose the military?,Why did you choose the Navy?,How did you decide you wanted to go into the navy?,What is your job today?,why did you choose your current job,,,,,,,,,,,,
"If you could do it all over, would you choose this career again?",if you were starting over would you make the same choices about your career?,do you regret choosing this career path?,do you any regrets about choosing this profession?,did you miss out on anything by joining the Navy?,what do you give up for the Navy?,what negative consequences have come from your work?,do you regret anything from going to the navy?,,,,,,,,,,,,,,,,,,,
