Describe the work you do on a typical day (on/off deployment),the work that I tend to do on a typical day actually depends on whether I'm deployed or not deployed so on the planet %HESITATION then you pretty much written the whole day and it's broken up into chunks the first part of the day is %HESITATION just getting together %HESITATION talking about how the rest of the day it's going to be do work orders %HESITATION we write about the things that %HESITATION we should be doing for it next week for the next couple of hours or something like that so the next chunk is we actually go and perform the work are so that's about another three or four hours %HESITATION the next chunk is we get back and we started %HESITATION doing training so we make sure that we're ready for casualties that if there's a fire if %HESITATION there's a flood %HESITATION then that's about the time that you get off work and you have a couple of hours just to kinda relaxing on hang out but %HESITATION leader on a night when you do this thing called general quarters which means that you come back and the whole ship opportunists like there is %HESITATION a big houses do you happen to the entire ship so you're just going to connect when your %HESITATION not deployed and you're stationed on you know stateside Dan you days are like easier on you have one part of training what we wanna do later on you have another part of training where you just open up a book in review some electronics or or nuclear power things and then all you have a small part where you just doing preventive maintenance I mean which was that you were gonna pump make sure that's fine opening up regulators picking through you know the things inside and out putting new technology 
What are you doing now that you aren't active duty Navy?,now that I'm not %HESITATION into active duty navy I joined the US navy reserves and I've been there for about the last eight years so that doesn't extremely difficult didn't say that it's two days per month two weeks per year and I've also worked a lot more than that but %HESITATION it's a minimal time in the military so I've had a lot of time to do whatever I wanted to I split between working at jobs for instance my job is I'm a I'm a Japanese teacher in Japan but also work for the university of southern California institute greatest technologies and %HESITATION I find little pieces the jobs here and there so I'm a part of a start up %HESITATION pure science started working with Richard reality %HESITATION I also go to school so I'm a full time master's student %HESITATION when I'm back in America and I am studying game development 
How much do you earn working for the Navy?,so your paycheck is one of the biggest things that people are really really love about working for the military right now my keys so I make about forty five hundred dollars per month %HESITATION well I don't think I have some of the US navy reserve but usually on active duty she's make forty five hundred dollars per month and they also have this thing called the eight bits of allowance for housing which %HESITATION Halmos doubles your paycheck so you get about like twenty five hundred per month %HESITATION in if you have that up it's about seventy five thousand per year 
How many hours do you work in a typical day?,the amount of hours that you work in a typical day actually depend on whether you deployed or not so if you deploy fighting the war then I see twelve hours would probably be the average on some days you get away with working only eight that's including Saturdays %HESITATION many days attacked every four days you're working in for Dana house so you stand your eight hours of %HESITATION normal work and he had to general quarters which is actually training at night time for two or three or four hours around and then you could have another watch from midnight until six the next day and you could possibly have your normal work day tacked on the end of that so you know some days if I if you're really in it are you working you know but they'd have to to %HESITATION Sundays were my kids these days where I only work for six hours and that's like a great day for me would you not deployed umpteen days are a lot easier on you probably get to work around seven and then you leave around around noon so that means your days only files 
What types of problems do you deal with on a daily basis?,problems show up every now and then %HESITATION when you're on active duty so it kind of depends on whether you're deployed or not if you deploy that means %HESITATION things happen you know with any any mechanical equipment so up comes could break in the middle of the night and then you get breaking up and you know you have to go %HESITATION fix it %HESITATION sometimes you have people that come in drunk on the weekends and %HESITATION one report so you'd have to make sure that like to get to their bed safely and that they get and later on %HESITATION things like that happen on the planet or would you not deployed then %HESITATION you still hear the drunk people coming in you know but %HESITATION because you're not the ship isn't being used over and over and over every single day in and out %HESITATION problems with the with the equipment doesn't happen as much so you just be preventive maintenance which means that even though this pump looks fine just gonna open it up and check to make sure that the will is there inside like you 
What kind of issues are there with alcohol in the Navy?,so you probably heard of the term drunken sailors and that's very good reason I don't know what you're on what you deploy and you pull into a port which is like a %HESITATION little CEO of a new kind then the people are very fancy they wanna get out and you know party a little bit so he probably been on the ship in the middle of the ocean Gavin seen another you know non military so for about a month so they really want to go out there and you know like on you know do the opposite of what they were doing witches are being disciplined now they wanna you know Gokul be young kids %HESITATION the military's basically eighteen to twenty four year olds so %HESITATION kind like the college life so they go out there and do college level things they find the first bar %HESITATION the city to others you know fine you don't two does alcohol in defined in there the whole entire day and then they come back to the ship the military knows this so we have people walking around %HESITATION checking into the bars making sure there are car causing fights which they are make sure that people are %HESITATION you know drinking too much which they are %HESITATION make sure that our people can make it home safely %HESITATION you know which means that they come back by taxi which means that they come in handcuffs sometimes but I it's all in good fun by the time we leave you used at at five thousand people or sometimes eight thousand people that are there on you only have maybe one or two that actually get into real trouble I personally didn't I I personally was involved that drug culture so much I'd like to go out to the to the town in sport you know the museums and the scenery in and things like that but %HESITATION I I I I had a few things myself to 
What is the Navy doing to combat heavy alcohol use?,as soon as you join the military %HESITATION call your very first week even though you're Holland Europe lookout so you have no access to alcohol but from that time you know all the weapons until you in your career you gonna be hearing about alcohol alcohol responsibility the fact that you can't drink too much the fact that you know alcohol ruins people's lives and it's it a very big thing %HESITATION for a for a culture so then maybe take some strides to kind of things this %HESITATION we get lots of training we get um Francis when we go to ports more on the planet we have this thing called the buddy system which means that you're not allowed to go out yourself yes I have to tap one of your friends and the both of you out so explore this new city they wanna make sure that you don't go out there and %HESITATION get yourself in trouble by drinking too much alcohol and then having a stranger you know got back to the ship they're people who would rather use their people who will you know do harm to you so the buddy system is problem the navy's biggest way to combat alcohol misuse 
How much did your friends impact where you ended up in your career?,so from that day that you join the navy you're going to find that you have similar past %HESITATION people %HESITATION better in your same field so you know are there people who were very motivated and want to become %HESITATION the master chief of the navy yeah some people who %HESITATION meager criminals before and join the military it's %HESITATION %HESITATION proving going to jail to be %HESITATION to be given a shot for normal life before the the one it up in a in a bad place so you have to hold them in of people %HESITATION and different creep past different televisions different on the motivations for being a military so in general people of a similar quality tend to hang out with us city people so people like to drink all the time you'll find that they're you know how this one house that we always go to over and over %HESITATION people that are very motivated %HESITATION study all the time you'll find that they've probably share a house with people who want to become an officer so you also find that %HESITATION that's very apparent with in the ports that you go to so for me I didn't want %HESITATION I wasn't a drinker at the time not not very much so I'm going to court and I try to tell people like Kate home you want to go see someplace fun you want to claim the number is it a castle so %HESITATION once we do that in this very limited chance of that we find problems %HESITATION some of the people who like a really you know really eager to have fun on the very first place that they go to the bar and %HESITATION people some of them are there and you get lots of people like that then %HESITATION probably if you find something to trouble so as long as you're aware of that on his long as you're not somebody that %HESITATION treats all the time and you don't want to get me in trouble was just fine trying to like visit ports and once I'm even though I don't wanna drink all the time I have to realize that if I visit people that are drinking all the time and I might get in trouble as well like as long as you can kind of you're where hear specifics here then on you have a much better time the military 
What is A-school?,the school is %HESITATION basic training that most military people join when they are when we start working for the navy so I'm lectures is made that means I would say in a school it's cool is it's only a lot my colleagues to give you the fundamentals of your job %HESITATION I learned %HESITATION electrical theory electronics theory %HESITATION things about voltage and current %HESITATION Howell health physics applies to the pump and a thousand given that we're using so %HESITATION in college it's very very sporadic you know my work for maybe two hours of three hours on Monday two hours in the morning you know three hours a night but for the military it's very very %HESITATION intense so they give you about a year or two years of training a short period of time it hours everyday Monday 
What are the major benefits of doing this kind of work?,so when you do this type of work you get a lot of benefits when I joined I I think I was working at McDonalds and %HESITATION the swap meet maybe the movie theater to I think I was working two or three jobs and you know all around here and %HESITATION I don't have any type of your action %HESITATION I know smart but I just didn't have enough time to you know pay my bills at the time so I joined the military and one in there %HESITATION fair promises were they said that you could have a really high paying job at the end of your career you know it's a six year contract so I said okay we'll have the skills of the three times now becoming physics don't thermodynamics chemistry bomb ends by the end of my six year tour I am I had enough knowledge to basically become Homer Simpson I could go out there and work a nuclear power plant fully full full of confidence so they give the skills that you need to get a really high paying job or a different job you know depends on which one did 
What do most people do after leaving active duty?,so at the end of their activity active duty tour you have a lot of options in front of you %HESITATION number one you can try to go back into the military if you like the career if you %HESITATION wanted to stay in the same field then you could so for instance the aircraft mechanics %HESITATION yes they were they were fixing Jackson they were working on jets so there aren't that many just that they could work on outside but Boeing is eager to hire those people %HESITATION you can see how jets and seven forty sevens kind of are the same thing so you can find something in your field %HESITATION for me personally I didn't actually like my field of please leave enough to make a full career out of it so I changed instead of electricians mate IE I became a computer scientist which is something completely different %HESITATION but I all the basic skills that I received the math and the physics the thinking logically about things they they still applied so my my computer science 
What are the major negatives of doing this kind of work?,so for all the benefits that the military job provides you can also have a lot of frustration with the job %HESITATION this for most people I think this might be the hardest that you'll ever work in your life %HESITATION that's how come %HESITATION %HESITATION the military has young people do it and then what they leave the vehicle that wants a productive careers but they always say you know what this is I can do anything because I work so hard for the military %HESITATION along with that long those long working hours you away from your family and that's a part of have long working hours so for instance the plane is probably everyone's major reason for getting out they want to see their kids grow up they want %HESITATION spend more time with their wife they one actually the parents have have a social life so these are things that you have to give up by joining the military 
Was it worth it?,for me personally them joining the military was one of the best things I could die you will work really hard and %HESITATION what you get out and you become a civilian you realize that what you did what is protect the nation you protected by the people around you the civilians and Tennessee even a job that you'll start to have in the job that they've always had you had a large part in making that possible so I think was worth it for the private to get for doing for serving your country and the skills that you that you obtain %HESITATION because I I didn't have any other skills before but from that point on had my education paid for and I had a valuable job that if everyone it's like at that point ending have love have a really high paying job so it was definitely worth it 
What are the main things that new employees must learn and adjust to?,really hard and %HESITATION what you get out and you become a civilian you realize that what you did what is protect the nation you protected by the people around you the civilians and Tennessee even a job that you'll start to have in the job that they've always had you had a large part in making that possible so I think was worth it for the private to get for doing for serving your country and the skills that you that you obtain %HESITATION because I I didn't have any other skills before but from that point on had my education paid for and I had a valuable job that if everyone it's like at that point ending have love have a really high paying job so it was definitely worth it what questions going what are the main things that employees must learn and adjust to the main thing that a new navy person has to learn is that you have to you have to be able to follow directions if you can do that then %HESITATION then you'll you'll be fine if you ever seen the movie Forrest Gump this is the person who had an incredible military affairs and the only thing they did was just follow the dress that people get in and out that's basically the truth %HESITATION won't get in trouble if you follow the directions that people give you your own you do your job well just by following the procedures that are part of you and in fact the main reason that people get in trouble is because they deviate from the chief tells them Hagel going to the built in spell it out and then he doesn't feel like it so he gets in trouble %HESITATION that she tells them Hey you know what I'm meet this procedure ABC in the don't deviate and keep things that he wants to do it really fast or I really quicker or you know so can you doesn't it never works out so as long as you follow directions 
How much travel did you do during active duty?,I didn't travel that much weight I lose %HESITATION in active duty I think we have like maybe one month per year on that we're allowed to take but I didn't I didn't really talk to my family that leads to I didn't have friends in far away places so I can imported my my leave days however what I saw in most cases is that %HESITATION during the Christmas season and during the summer people take two weeks and are in the middle of the year two weeks at the end of the year to go all across the country to go back and visit the family so liberty vacation is something that the navy is very generous about 
How much travel did you do during active duty?,one month per year so that's a lot of travel %HESITATION that I'm allowed to do but I didn't do too much of it coming just stayed at home with this thing called the military bubble where you can just hang out with the people in your same unit %HESITATION don't really get out that lights it and it's fun for awhile on you have a lot of money so you can do lots of things you can on take these things called mac flights where you can if you're on leave can travel across country for basically free on but I think I was just waiting to become a civilians actually %HESITATION really enjoy myself so I just poured all my all my travel days till the very end 
What countries did you visit on Port Calls?,so we're going to play me you can have these things called apart cause which is where you go to the country go to their major city and then you can like at the time of your life so places that I've been to that really %HESITATION I really enjoyed where on Hong Kong Malaysia Singapore %HESITATION I went to Australia three times I went to Bahrain Dubai %HESITATION also went to Japan %HESITATION that's round trip from the work right now so I want to about ten or fifteen countries 
How much travel do you do now that you're out of the Navy?,since I became a civilian I think I travel a lot more than I did in the navy with the navy yeah actually %HESITATION get stationed all over the country %HESITATION now and civilian I would stay in the %HESITATION in California that's my hometown but I have the opportunity and adopting you travel a lot more so I take flights to %HESITATION York just if I feel like it %HESITATION I take %HESITATION drives to Las Vegas on because coming closer to Los Angeles and %HESITATION I also still to travel a lot because of the US navy reserve so and then get the reserve the sea to the four corners of America we go to New Hampshire %HESITATION Virginia also to Washington in San Diego so I'm pretty much every year that's inside me there leave your free a free car and a free hotel so it's kind of like a little mini travel work isn't that difficult so I use that as a waiter to get out I was also stationed in Hawaii last last year and it was really fun 
What lifestyle changes does being in the Navy involve?,so some of the lifestyle changes that you can expect number one you where did you get used to wearing a uniform unity in putting this thing on every single day I we have a couple of different %HESITATION styles to choose from problem we can throw coveralls a friendship %HESITATION these the we can use that where you're walking around a normal city %HESITATION but we also have like a dress whites in dress blues Conde look really nice another lifestyle change you can expect is thought to be following orders so if you're working at McDonalds in you have a boss telling you know go to drive thru go duh %HESITATION some practices in the morning so same thing that that's not going to change just because you're the military in fact is going to get a little bit more out more intense you can stay so you have to you know five six boxes %HESITATION they have a hierarchy and when I hear from one less than the other but you're gonna be hearing you know what to do every single day 
Did you like wearing the same uniform?,so this uniform that we have is first of all I like the colors makes you look really really military can say say that there's this person onstage seem jobs used to wear the same exact thing every single day and he was very successful %HESITATION has a has a computer manager %HESITATION and he said that he wore the same exact thing because he didn't have to think about what to wear every single day so you didn't have that impression here you know like you know what's going to wear so there's like very very little thought process of what what is going on was going to be just it is gonna be the same thing or yesterday or is it gonna be this new press one but it's going to be cameras today 
Who are the most important people in the Navy?,it is the message you of an eighty there's the secretary defense obviously the president vice president knows that the hierarchy in obviously if you're an active duty then you have your commanding officer you have your excel and those of the like on if the president and vice president of your little commands %HESITATION like specifically within your rec center %HESITATION the chief is the guy a TV series even acetate those of the people that are in charge of all the illicit people and it there your whole world that's your mom your dad 
How much do you understand the overall goals of what you are doing?,so acted made many people who are actively working for the navy don't really know how they fit into the big picture and that's by design %HESITATION it's very specialized so for instance as in he wanted you to eat three %HESITATION your whole entire world is to do this technical job to fix a problem so to paint this wall and %HESITATION you might not see it but making sure that part is fixed or making sure that wall is painted make sure that the ship to run because for the ship to run make sure that the officer can fly jets because for that that Jack is fixed and that piling those information we should make you can drop this bomb making sure that bomb drops make sure that the battle is won because of the battles one make sure the wars one so when you pinning that wall you don't really see how that is actually helping you win the war in Afghanistan but it does so the higher you get in your illicit %HESITATION pay grade the more you see that big picture how many seven so my responsibility is to know how this unit can help the civilians %HESITATION make sure that %HESITATION this aircraft here runs fine and I think as officers of the higher you get no if your captain you make sure that this aircraft carrier it's in this %HESITATION realm of the reason so that like we have a power over there we can dominate our foes so it depends on on your pay grade 
How much of your private time is spent doing your job?,so with the military your job is your life you're in the military for twenty four hours even on the weekends so as long as you you know encompass this fact you know make that a part of your being in on you understand why it is that on at night time you might still be working on some kind of project so for instance if you're on maybe one three six you have a normal work day and then %HESITATION you might be called back in some sometimes it's %HESITATION make sure that a night event can go on as required and on nobody ever has a problem with that but usually it on for the floor you one three six %HESITATION they have a full time job %HESITATION when when the plane in which it means that were out there fighting the war then they're called all the time %HESITATION when you're back home and you have your family life and on he expected to go home every single night then it's to give you a little bit tricky trying to balance both of them %HESITATION your civilian life is it can be really tough 
